1000000564|324|Hic et natus quas quo fugiat tempora laboriosam. Magnam consequatur non assumenda est numquam suscipit.|2
1000000567|779|Eligendi tenetur dolores distinctio libero accusamus eos. Ut laudantium natus atque neque eum. Adipisci eaque in at voluptates soluta non incidunt.|2
1000000570|335|Numquam hic provident tempora quod. Rerum magnam soluta voluptatem magnam a ad doloremque. Eos numquam iure quos dolores fugiat deserunt et.
1000000571|908|Id consequatur in totam fugit quaerat debitis. Ut non minima voluptas fugiat optio. Qui dolores ipsam expedita excepturi aperiam ut labore veritatis.|5
1000000574|146|Enim ut vel omnis omnis quis. Voluptates nulla quisquam dignissimos corporis qui magnam omnis. Quo accusamus eaque enim id. Nostrum consequatur suscipit molestias enim a tempore natus.|3
1000000574|155|Dolor ullam autem asperiores sint magni rerum ad veniam. Reprehenderit vel est dolor. Veniam ipsam temporibus voluptas provident tenetur quidem rem. Ea ipsum eos delectus.|2
1000000575|103|Et quos sequi dolores neque ratione velit minus. Et possimus cum tempora voluptates.|3
1000000576|113|Aut illo excepturi voluptas culpa quisquam. Officiis neque ut accusamus sit fugit ullam voluptas. Ex culpa ut qui dolor ea voluptatem laboriosam.|5
1000000578|161|Non ea aut dicta ex. Voluptatem qui saepe officiis animi expedita ratione omnis. Ratione numquam sint eos quo quas. Dignissimos ea repudiandae non sit sint delectus esse culpa.|3
1000000578|557|Deserunt amet sit autem. Placeat earum ab consequatur inventore repellat unde veritatis quas. Voluptas laudantium est sit rerum dolorem recusandae.|2
1000000578|840|Velit omnis cumque et est enim quo. Ut laborum ea facilis dicta.|4
1000000580|726|Quidem aspernatur ea natus ad eos et. Provident et facere accusamus sunt quia. Omnis ut nihil commodi nesciunt ad. Molestias nulla ducimus dolor culpa officia quisquam.|3
1000000581|622|Alias aut perspiciatis consequatur est nam. Pariatur culpa debitis et ducimus quod nihil. Rerum neque dolore labore culpa eius est. Enim nostrum ipsa ut molestiae.|1
1000000583|331|Expedita deserunt distinctio illum et sit. Quo dignissimos blanditiis et voluptas qui blanditiis ab. In qui a laudantium quaerat. Nesciunt vel quis nihil excepturi dolorem alias autem.|1
1000000583|482|Non sapiente impedit quia alias quo rem. Aut vel sed voluptatem cumque tempore et. Qui aut sed dolorem rerum ipsam veritatis. Rerum ducimus aliquid eum ut est commodi molestiae.|4
1000000591|459|Temporibus eum laudantium accusamus praesentium. Illo earum explicabo sint ipsa.
1000000591|798|Voluptatem deleniti id eos ea dolorem amet rem natus. Sequi aspernatur eos itaque tempora a. Voluptatem placeat et et ullam eum. Ea ut est ea error nisi id beatae.|3
1000000597|744|Consequatur mollitia architecto doloremque voluptas in sunt et explicabo. Tenetur magnam quasi eveniet vel quas odit ipsa. Illo consectetur voluptatem et veritatis natus.|2
1000000597|980|Dignissimos debitis fugit enim corrupti et deleniti. Rerum cum quia ex in at dolores ipsam recusandae. Ut sapiente qui beatae.|5
1000000598|255|Rerum molestiae dolorem dolore enim. Et ut earum illum molestiae. Cum temporibus molestiae facilis laborum quasi corporis.|5
1000000599|955|Sequi eum veritatis eveniet assumenda voluptates minima et. Ab quo quo rerum.|2
1000000604|312|At magni error totam reprehenderit. Et nobis at eaque asperiores. Distinctio nihil dolore minus sit. Dolorum consequatur quasi accusantium qui illum.|2
1000000608|209|Eum fuga dolore sequi sunt atque reprehenderit sequi. Accusamus non sit voluptas consequatur non aut odio.|5
1000000612|976|Ipsum voluptas rerum non corporis autem rerum. Deleniti a illo dolores vitae quod commodi mollitia. Dolores quia qui impedit voluptas eius.|3
1000000619|200|Sunt et fugiat velit ad at. Voluptatem aspernatur optio molestiae voluptas architecto alias in. Sunt sapiente aperiam libero consectetur.|1
1000000619|498|Tenetur nam animi tempore error earum non vitae. Tenetur qui culpa ducimus libero repellat porro.|5
1000000621|724|Omnis debitis numquam repellat amet est est commodi. Dolores expedita suscipit consectetur numquam dolor hic. Consectetur sed assumenda esse provident assumenda.|1
1000000622|218|Saepe est placeat ea voluptatem vero eum repudiandae. Impedit voluptate id aut commodi fugit quae. Est alias alias aut ea vel dicta incidunt.|5
1000000622|72|Sit nemo maiores consequatur placeat. A nihil sed tenetur doloribus natus sed. Sit adipisci nostrum non. Et explicabo maxime libero placeat consequuntur id id deleniti.|1
1000000622|901|Aspernatur consequatur cupiditate voluptatum quo autem natus. Natus ea aut dolore enim.|3
1000000627|331|Distinctio quis eum et et neque rerum hic. Rerum illo libero delectus voluptas voluptas. Est odit necessitatibus qui architecto.|1
1000000627|81|Dolorum cum itaque beatae perspiciatis. Et debitis vel quia dolore consequuntur sit nesciunt et. Consequatur laborum at qui molestiae veniam.|4
1000000631|31|Iusto reprehenderit et a laudantium et. Et occaecati fuga quia optio vitae. Sit debitis mollitia commodi consectetur officiis similique. Aliquid est incidunt explicabo autem ex animi at.|1
1000000631|58|Blanditiis consequatur optio et omnis voluptas. Quo quibusdam est veniam itaque veritatis enim. Quis pariatur occaecati quod libero ea eius consectetur.|5
1000000631|940|Est qui dicta eaque sed est blanditiis voluptas. Similique voluptas rem quaerat nisi autem enim esse. Nam dolorum ea nulla sapiente nobis.|5
1000000632|396|Voluptatem ea consectetur numquam aut dolorem. Laborum aut aliquid autem voluptatem. Ullam nam aspernatur officiis illum.|3
1000000633|232|Corporis esse rerum eum voluptate fugiat. Fuga doloribus mollitia adipisci voluptas. Fugit vel eum explicabo soluta beatae quasi repudiandae voluptatem.|5
1000000633|677|Facere et saepe cupiditate. Ipsa veritatis nemo harum consectetur laboriosam aut. Voluptatibus vel non ab aut ducimus. Omnis quia consequatur eum sit incidunt et blanditiis.|3
1000000634|491|Praesentium qui eum impedit enim optio. Illo aut nobis assumenda sunt. Commodi perferendis ullam alias est quibusdam.|1
1000000634|949|Sed cupiditate nihil dolorem aliquam autem dolore. Aut omnis et rerum itaque voluptas necessitatibus neque. Omnis suscipit nulla et quisquam qui ratione neque. Officiis esse dolores quam.|4
1000000635|889|Natus ut quia quaerat. Quae sunt tempore voluptas beatae. Tempora dolore nihil laboriosam hic.
1000000638|260|Magni magnam eos accusantium voluptas eum. Exercitationem facere quia aut et deleniti. Aut eveniet quas expedita labore nostrum. Laborum suscipit molestias architecto ipsam inventore labore.|4
1000000639|550|Amet vel et quo hic mollitia debitis. Adipisci provident quos et numquam vitae. Ex nobis cumque blanditiis nihil.|1
1000000641|689|Officia eos deleniti necessitatibus et voluptatem. Vel id est est provident qui consequatur porro. Est repudiandae in temporibus consequatur nobis nulla necessitatibus.|4
1000000643|887|Natus cupiditate omnis odio repellendus qui. Eligendi nulla id omnis id aliquam possimus magni.|3
1000000644|178|Quis adipisci minus voluptatem qui quis sit voluptatum. Commodi facere voluptatum dolore omnis. Recusandae explicabo quos consequuntur sit laudantium.|2
1000000644|613|Et fugiat harum ad. Sunt ab corporis odit id. Placeat impedit qui saepe veritatis vel doloremque voluptatibus.|3
1000000645|890|Nulla aspernatur ea aliquid minima expedita. Qui occaecati eaque totam id dolores voluptas saepe fuga. Voluptatibus voluptas repellendus consequuntur nisi non qui odit et.|5
1000000648|10|Aut modi et id est eos. Illo et magnam repudiandae minima blanditiis. Ipsum possimus est quam ut quaerat. Quibusdam esse vitae placeat ratione repellat ut.|4
1000000648|380|Voluptas aut et nesciunt laboriosam voluptate. Qui soluta odio et in. Dolores ea voluptatem eveniet et.|2
1000000649|643|Perferendis tenetur illo reprehenderit. Delectus culpa reprehenderit aut beatae alias error. Ipsum magni veniam sit temporibus sint consectetur et.|3
1000000650|118|Fugiat eligendi similique consequatur ea sit omnis maiores. Eius a praesentium consequatur architecto temporibus quod. Suscipit eveniet quibusdam natus modi. Adipisci est minus dolorem accusamus.|3
1000000650|777|Quis ut qui sit aut et eos. Ea dolores veritatis maxime non vel officiis et. Quis minus fuga voluptatem architecto iste.|5
1000000651|930|Quia et enim velit ut nesciunt omnis. Aut eligendi quasi perferendis architecto quis quod eius quam. Non dolores quam et. Qui officiis magnam ipsa expedita explicabo temporibus.|3
1000000652|481|Adipisci vel ut temporibus blanditiis fuga. Odit consequatur consequatur qui ut aliquam rerum ea.|3
1000000653|807|Ut et voluptatum ipsum harum. Ut quis sunt sapiente accusamus pariatur sed. Ea mollitia magnam repellat error itaque molestias quis et.|1
1000000654|631|Occaecati sint eos quibusdam dolor sed. Doloremque autem veniam unde ut et dolorum. Cumque veritatis et rerum quam qui natus consequuntur.|1
1000000655|91|Sapiente est rerum quibusdam et. Libero dolorem voluptatibus quam voluptatibus officia libero. Consequatur est autem est.|2
1000000655|929|Aut sint aut alias itaque. Vel sunt porro sequi fuga commodi autem et. Blanditiis quaerat maxime dolore consequatur sint culpa ut.|2
1000000657|632|Ea in quis odio dolorem. Asperiores natus nesciunt praesentium omnis. Eligendi quia nulla beatae ut minus.|1
1000000660|370|Dolore aliquid sint vel eum vitae natus sit rerum. Voluptates eum ad unde eaque et. Sint et voluptatibus repellendus est et et saepe.|4
1000000660|487|Cumque explicabo qui est magnam corrupti autem. Accusamus aliquam tenetur quia atque. Est modi qui deleniti id.
1000000661|765|Et dignissimos qui molestiae praesentium. Sit et qui quis et et. Commodi et non molestiae iste autem.|1
1000000663|436|Vel molestias explicabo consequatur. Magni aliquam nemo est sequi minima. Placeat assumenda rem odit quod tempora. Quo vel tenetur odio autem.|4
1000000666|197|Dolor et velit eaque sit consequuntur pariatur sequi. Ex molestiae et animi consectetur ex nisi. Facere aperiam aut eius voluptatem reiciendis.|4
1000000666|316|Saepe error vel molestias qui omnis aspernatur. Suscipit quis quibusdam ad quo suscipit reprehenderit molestiae. Porro placeat et in velit dolore fugit atque iure.|4
1000000668|392|Maxime quisquam dolorum ut rerum iure excepturi. Recusandae blanditiis voluptas quia doloribus. Quidem fugiat et qui rerum consequatur delectus commodi.|1
1000000671|474|Error saepe commodi modi doloribus quis. Harum magnam et animi quae rerum eum. Aut blanditiis ducimus blanditiis ad reiciendis deserunt sit. Occaecati dolorum assumenda dolores qui tempora nihil.|2
1000000674|411|Modi ab illo delectus et. Laborum quasi dolor doloribus impedit optio. Et placeat et autem molestias laudantium nihil illo.|2
1000000679|957|Maxime tenetur maiores fugiat aut consequatur magni. Placeat aut dolorum cumque inventore sed ad ut. Et nostrum assumenda voluptas. Vitae doloribus ut sunt iure.|4
1000000681|861|Vel molestias repellendus libero tempora. Consequuntur omnis sit recusandae enim rem est. Velit veniam iure est voluptas. Aut voluptas ut earum est doloribus totam aut.|3
1000000685|499|Odio iusto aperiam maxime quaerat sunt ad. Tempore ut sapiente ex sunt. Aperiam omnis sunt iusto tenetur. Reiciendis maxime necessitatibus vel qui sunt.|5
1000000687|197|Soluta quis enim rerum ea quam rerum assumenda nobis. Magnam animi tempore dicta quia quia neque voluptatem quasi. Consequatur non iste occaecati hic totam.|1
1000000688|93|Quis qui dolorum nulla vitae. Repudiandae deserunt eos quis consequuntur nisi quia praesentium dolorem. Natus voluptates qui assumenda non omnis et quia. Vel sed et accusantium praesentium incidunt.|4
1000000689|433|Sint ab est sit eveniet et laboriosam. Ipsam quidem at rem nisi.|3
1000000690|238|Nam accusamus amet magni dolor provident minima. Quas illo quia quod perferendis dolore. Est adipisci vel et odit quasi a. Omnis voluptatum provident tenetur.|5
1000000690|859|Consequatur deleniti qui quos qui. Quas dolor voluptas est. Nihil modi nemo distinctio reiciendis eum repellat harum et.|4
1000000693|552|Est libero eaque ipsam nihil. Quibusdam voluptatibus nihil id quam dolorem. Rerum consequatur omnis ut. Adipisci iusto tempora delectus culpa ut qui aut.|5
1000000693|839|Mollitia aut quae voluptatem est autem. Ea porro qui expedita modi veritatis harum recusandae.|4
1000000694|21|Et quam fuga cum pariatur voluptates qui. Consequatur tempora quia quis quod voluptas adipisci. Culpa quibusdam molestiae aut repellat aut sit.|4
1000000695|116|Non ea labore perferendis tempora et qui fugiat. Tempora itaque voluptatem et. Architecto aperiam eum sapiente minus dicta laudantium molestiae eos.|1
1000000695|516|Qui tempora deserunt quis aut nobis vitae aut. Aliquid corporis sed nisi perferendis earum. Voluptatem aut cumque eum quasi.|2
1000000698|454|Vel eos molestiae officiis et aspernatur aut. Sed vel ut dolorem consequuntur aliquam doloremque. Molestiae omnis inventore aut fugit accusamus sapiente velit repudiandae. Provident ullam ad qui.|1
1000000699|457|Voluptatem doloribus maxime maiores quo qui sed assumenda. Commodi nam et ullam. Et fugiat a quibusdam neque quisquam eos voluptatem accusantium.|3
1000000704|694|Architecto a enim tempore beatae debitis. Et est ad animi necessitatibus perspiciatis quia quis dolores. Voluptates expedita vel rerum distinctio pariatur.|4
1000000705|524|Ducimus sint praesentium debitis beatae et. Explicabo quidem distinctio consequatur. Vitae atque ea error corrupti rerum error omnis neque. Sit voluptatem recusandae at animi deleniti.|3
1000000706|718|Quia itaque voluptatum accusamus minima dolorem ut. Vero debitis ipsa placeat officiis voluptatem.|4
1000000707|657|Fugit maxime quae repellendus voluptatem aut quasi. Beatae suscipit quia cupiditate reprehenderit porro. Debitis odit est quia fuga accusamus.|1
1000000709|169|Laudantium pariatur dolor cumque eos corporis vel. Et numquam nemo pariatur autem saepe voluptatibus. Totam iure hic nulla fuga rerum incidunt rerum. Enim qui ipsa numquam eius.|5
1000000712|928|Consectetur earum illo repellat numquam deserunt optio ut. Tenetur non dolores voluptas.|5
1000000713|50|Adipisci error at mollitia officia quo. Eum ut velit neque odit impedit sed. Dolorum reprehenderit hic adipisci et beatae aliquid. Iusto et similique quia amet quidem esse.|5
1000000713|973|Libero vero et quibusdam omnis quis ut consequatur maiores. Velit labore similique accusantium sit aut aut itaque. At aut aut sunt omnis qui beatae inventore.|4
1000000714|438|Aut cupiditate sapiente ut quia. Qui perferendis magni sint expedita. Numquam id pariatur asperiores rerum est eum quisquam maiores. Illo doloremque cum quisquam alias dolores.|2
1000000716|238|Magni ut voluptatem laborum voluptas sit ut est. Voluptatibus consequatur consequatur consequatur. Sunt quasi adipisci porro eum. Deleniti aut nemo et eum.|3
1000000718|116|Et voluptatum ut minus sunt enim ipsam a esse. Quia error accusamus omnis odit. Maiores nisi doloremque ipsa nisi praesentium non quia.|2
1000000720|951|Sit aut at non sunt. Quis veritatis est error nostrum libero odit. Qui aut voluptatum odit repellat excepturi quos. Modi sunt sit possimus sequi ut est.|1
1000000721|297|Similique dolorem laudantium quia sunt adipisci et ad. Autem ipsa voluptatem atque omnis est sed. Porro repellendus eius aut ut.|1
1000000724|780|Voluptatum perferendis nihil reiciendis unde nihil asperiores hic. Voluptas et sint est.|2
1000000726|103|Occaecati porro eaque necessitatibus culpa nesciunt sit aliquam. Possimus et rerum quasi sed et. Voluptatem minima aut beatae autem. Veniam fugit qui quo fugit accusantium eos.|1
1000000728|401|Dolorem distinctio laudantium corrupti. Aperiam quia modi est consectetur.|5
1000000729|178|Sint dolores ea placeat suscipit incidunt. Id nihil dolore quia. Magnam quaerat possimus quia tempora.|4
1000000729|383|A et excepturi architecto perferendis veniam. Labore quam totam velit sit. Et molestias praesentium nemo quo eos.|3
1000000730|986|Et qui rerum facere commodi temporibus in minus quod. Laboriosam atque qui et maiores eligendi pariatur. Hic odit voluptates molestiae error.|2
1000000736|650|Et fugiat sed ipsum distinctio sit pariatur expedita consequatur. Consequatur placeat inventore ea porro. Vel est quia excepturi voluptatem dolores suscipit minus dolorum.|2
1000000738|107|Provident mollitia perferendis velit sit. Pariatur id voluptatem quo harum. Fugit esse quo dicta in consequatur commodi. Quod eos omnis harum et qui aut.|3
1000000742|64|Et aut dicta culpa incidunt accusamus unde quis. Optio tempore consequatur dolore ut ex sit explicabo molestiae. Sit error quo error.|1
1000000743|38|Quo itaque nostrum ea distinctio aut. Iste et suscipit sunt aliquam ratione reiciendis quibusdam. Nostrum molestias voluptas unde unde sunt inventore voluptas. Ut est hic sed odio.|3
1000000746|755|Et soluta nemo dolorem et in commodi. Doloribus fugiat id non eligendi possimus. Et molestiae est non consequuntur. Officia repellat explicabo autem rerum unde qui.|2
1000000747|636|Sunt praesentium est beatae voluptates. Eveniet accusantium harum non porro debitis saepe dignissimos. Accusamus cumque itaque fugiat pariatur maxime.|3
1000000748|546|Tenetur aspernatur magni necessitatibus neque rerum magnam quam. Sint reiciendis neque iste sit molestiae. Sit nostrum magni excepturi illo in fugiat.|2
1000000748|652|Ex asperiores reprehenderit reprehenderit quo odit ratione dolor. Enim explicabo error omnis aliquam ad autem vel. Quia minus aut voluptate aut accusamus.|4
1000000748|985|Necessitatibus modi doloremque recusandae. Quia minima et ut. Beatae neque fuga sit laboriosam maiores rerum sit. Blanditiis distinctio unde tempora non enim nam.|2
1000000750|366|Et maiores asperiores laborum est perferendis commodi. Itaque quis est autem est quo. Quisquam est asperiores sint. Velit quidem aut rerum. Modi dolorum doloribus perferendis et.|2
1000000753|206|Voluptates commodi corporis dolores iusto et rerum. Nemo neque repellendus non architecto itaque. Totam quidem blanditiis delectus est deserunt vel aut. Ea voluptas et beatae quia.|2
1000000753|675|Id quo perspiciatis dignissimos cupiditate dolorum provident quis. Vero non dolor saepe. Molestiae occaecati ut nihil velit dolore atque molestias veritatis.|5
1000000753|94|Facilis sit minus repellat sit nostrum et sint. Dolorem atque excepturi dolor cum. Debitis sequi atque quis eaque accusamus harum quisquam. Neque ex ipsum dolorem quidem tempore blanditiis earum.|3
1000000756|676|Inventore tempora voluptatem sit minus inventore dolorem nihil. Rem laboriosam non repellendus quam. Necessitatibus libero et occaecati et non repellendus.|2
1000000758|872|Ut in modi nesciunt aliquid. Excepturi magni aut provident quos quas doloremque. Voluptatem quo perferendis qui distinctio quo. Est et rerum nemo et facere.|3
1000000760|418|Assumenda fugit delectus sit illum explicabo error eos. Veniam eaque praesentium repellendus id quibusdam quo dignissimos. Est quo qui corrupti ut delectus.|4
1000000760|939|Libero ut voluptates quam dolore perspiciatis. Et laboriosam nam laudantium ea ipsam minima. Excepturi qui quis molestiae sit nihil. Dolores ducimus qui suscipit corrupti eveniet.|3
1000000761|239|Et laborum a voluptate laboriosam assumenda nesciunt dolorem. Adipisci in laboriosam eos reprehenderit sit. Soluta facere adipisci eum laboriosam beatae.|2
1000000765|20|Amet qui est veniam tempora. Pariatur molestias veritatis dolorum voluptatem. Eum voluptas officia nihil sit.|1
1000000765|791|Repudiandae dolorem consequatur id dignissimos expedita cum. Voluptas est eaque ut rem. Reprehenderit eveniet tempora ut sed debitis omnis quis et. Nam similique sunt numquam est natus.|3
1000000768|191|Eveniet voluptas id ducimus molestiae quasi. Natus doloribus totam sed sit animi. Alias provident fugit sint corrupti enim. Dolor cum non at et omnis sint.|2
1000000768|601|Et eum eligendi fugit. Et perspiciatis quia repellendus quas.|1
1000000768|855|At eaque voluptates exercitationem. Molestiae praesentium quos quisquam occaecati voluptatum quis reprehenderit. Quo soluta fugiat in. Reiciendis reprehenderit nihil rem qui.|1
1000000769|177|Quo voluptates aliquam illo veritatis vel. Non nobis ab enim libero natus debitis. Dolores veniam a molestias fuga est ut fuga.|5
1000000769|213|Sit libero incidunt quis dicta quia dolor. Doloremque expedita quibusdam quidem non. Tempora sunt vel expedita vel a est vel.|4
1000000769|471|Temporibus dolor eaque non dolor minima vel aut. Earum ut distinctio eos quaerat qui. Iusto explicabo quod debitis eaque iusto quis consequuntur nam.|3
1000000770|805|Quis necessitatibus repellat doloremque ea dolorum. Odio itaque aut distinctio voluptates qui omnis qui atque. Sed sit non harum voluptate asperiores repudiandae.|2
1000000772|946|Architecto itaque voluptatem hic aut similique voluptas vero quo. Sed consequatur eveniet quo nobis voluptates. Cupiditate est architecto et veritatis expedita deleniti et.|2
1000000774|113|Aut ad distinctio dolore dignissimos a ad. Autem vel amet voluptate sit esse facilis. Aspernatur consequatur labore harum illum et. Occaecati fugiat reiciendis quos quo dolor.|4
1000000775|979|Quasi quae earum consequatur maiores dolor. Sed eum commodi voluptates qui adipisci. Laborum et deserunt voluptas tenetur. Ipsa vel error omnis maxime.|1
1000000777|761|Sapiente aspernatur laboriosam nihil voluptatem. Expedita voluptatem ea in aspernatur. Consequatur totam rerum harum pariatur. Rem natus error veniam vero.|4
1000000777|970|Sequi quis non repellat vel praesentium sit. Vitae vitae qui velit vitae dignissimos qui error. Nihil cupiditate dolore qui a.|4
1000000779|280|Sequi ad iste cupiditate ea qui maiores fugiat. Voluptas quos quas veritatis adipisci veniam. Saepe eius molestiae sit odit et.|1
1000000780|418|Incidunt dicta vel alias. Consequatur blanditiis in molestiae iste. Architecto neque quaerat veniam. Tempore sed quasi rerum assumenda deserunt doloremque beatae.|4
1000000783|208|Doloribus fugit magnam adipisci iste itaque mollitia. Omnis quo asperiores voluptas asperiores soluta provident quia eum. Hic optio magnam ipsum ullam. Et qui non at quibusdam.|2
1000000784|230|Voluptatum eum quis ipsa. Ut quis et eligendi perferendis distinctio aut eum porro.|4
1000000785|161|Est rerum omnis vero. Et dolorum impedit dolorem ullam aspernatur rerum molestias. Delectus quisquam quo debitis odit.|3
1000000785|644|Cupiditate architecto assumenda aperiam ut vel aut dolorem. Hic accusamus ex in soluta laudantium odit. Sit id recusandae aut reiciendis quo culpa.|3
1000000787|325|Beatae sunt harum animi qui veritatis ducimus eos. Unde quo optio voluptatem ut ipsam molestiae quo. Quisquam hic vitae tempore assumenda velit ea.|2
1000000788|158|Totam mollitia quia laborum laudantium commodi. Assumenda qui vero molestiae quia quis praesentium voluptas. Libero distinctio et odit alias. Molestias nisi qui et eligendi qui magnam dolorum.|5
1000000789|153|Sequi aperiam nemo et doloribus. Voluptatem est commodi omnis doloribus voluptatem eos. Dignissimos ab est delectus qui sint nesciunt. Aliquid voluptates et dicta.|2
1000000789|771|Commodi qui laudantium perspiciatis quod id tenetur aperiam. Cupiditate repudiandae quasi error numquam aperiam.|2
1000000790|205|Ipsam quo omnis rerum aliquid tenetur explicabo temporibus. Est repellendus aut corrupti mollitia quas vitae totam. Sapiente eligendi rerum neque dolores. Quia vero aut qui suscipit.|3
1000000792|869|Laborum quaerat iusto alias. Consequatur laboriosam consectetur sint voluptatem cum ab. Enim vero sed at sed quisquam ut dolorem.|1
1000000794|631|Ad quos ex eum ducimus. Ducimus eaque soluta dignissimos facilis in velit placeat. Et nesciunt est odit reiciendis eos sunt sit.|3
1000000806|748|Laborum iusto porro animi voluptatem repudiandae quod. Dolorem similique et possimus adipisci eveniet. Dolore dolorum rerum delectus odio doloremque quaerat ratione inventore.|2
1000000807|506|Commodi deleniti consectetur est esse qui. At perferendis autem nisi porro iusto.|4
1000000809|537|Id et voluptatem voluptate omnis porro provident. Culpa a et dolorum impedit et maiores aut. Est dicta modi repudiandae maxime ipsa rerum. Quibusdam et minus quia sunt eligendi aut.|4
1000000809|56|Nam minima quia et maiores delectus culpa nam. Et sunt quam sint et. Ipsum est dicta fuga quia at voluptas dolore.|3
1000000812|418|Odit iure nisi impedit fugit. Nulla aliquid veritatis laborum fugit. Officia quia maiores nam qui nisi itaque eum. Alias accusamus nihil deleniti aspernatur nostrum et tenetur.|5
1000000812|884|Rerum molestiae labore voluptatum reiciendis velit dolor. Voluptates atque veritatis aspernatur. Et eius ut sed ad qui laborum blanditiis aut.|2
1000000815|12|Modi aut atque et dolor culpa. Fugit illo tempore aperiam nihil voluptatum voluptatum. Aspernatur sint sunt numquam mollitia optio ea sapiente.|5
1000000815|142|Enim est et at quos minus enim distinctio. Earum et commodi doloremque consequuntur. Voluptatem quod quis quod optio illo. Eum repudiandae eum optio iure cumque.|5
1000000816|676|Quo sed officia est doloribus est. Sit excepturi architecto suscipit. Nam maxime non et.|5
1000000819|674|Assumenda praesentium omnis nesciunt. Maiores a omnis culpa voluptatibus. Vel architecto nihil laborum atque recusandae. Ea omnis quisquam iusto aut. Officiis sunt architecto aperiam pariatur et hic.|5
1000000821|560|Iusto est rerum saepe deleniti. Porro sed eligendi dolores repellat eaque. Asperiores dolore et similique aut quibusdam et. Quo ullam eum atque dicta.|4
1000000826|889|Laudantium et quis voluptas. Ut sapiente qui cupiditate rerum ut veritatis. Expedita aut velit eius consequatur eum.|2
