1000001104|917|Impedit natus sed dolor reiciendis. Expedita est dolor qui error. Dolor quia maiores quo adipisci. Excepturi blanditiis accusantium illum libero dolor veritatis est.|1
1000001105|213|Sint quia atque officia odit optio suscipit. Tenetur non voluptatem in quibusdam quia laborum voluptate. Omnis assumenda harum harum quisquam adipisci. In inventore non nulla quas.|4
1000001106|725|Est dolores qui voluptas quam suscipit. Corporis amet culpa qui aliquam est numquam. Aliquam minima et consectetur.|1
1000001107|578|Similique rem voluptatem iure non qui reiciendis dignissimos. Non quasi aliquid cum dolorem. Est voluptas eum magnam natus.|2
1000001112|581|Saepe rerum aliquam ratione eos qui qui ullam. Occaecati est saepe et architecto debitis facilis. Omnis explicabo est expedita aut. Cum sed quae et maxime quia.|3
1000001116|571|Quia ut quos distinctio reiciendis. Facere maxime quo quia debitis quam hic. Magni aspernatur magnam voluptate veritatis qui.|5
1000001118|786|Sit culpa et praesentium praesentium esse distinctio. Ea rerum dolorem quos odio nemo. Ab aut fugit sapiente eos.|4
1000001118|886|Architecto autem perferendis rem inventore. Est quasi sunt porro ut quidem. Rerum sit quo nobis est consequuntur deleniti qui. Labore deserunt numquam vel placeat ut vero.|5
1000001119|913|Est placeat illo qui cupiditate veritatis. Aperiam ut fugiat placeat nihil velit voluptatibus. Ipsa totam sunt quibusdam omnis recusandae et. Voluptas ut et est tempore unde optio est.|5
1000001120|811|Id perferendis quia atque. Ut saepe aut totam ut.
1000001121|401|Corrupti voluptate odit quis harum aut quo quia. Voluptates nemo quod iusto itaque hic praesentium rerum.|4
1000001122|464|Aut accusantium earum commodi similique velit recusandae est consequuntur. Vitae molestiae aut dolorem veritatis. Non excepturi rerum dolorem quo corrupti.|5
1000001127|761|Sunt facere et a cum. Vel ab quia fugiat.|5
1000001129|327|Molestiae debitis accusantium neque nemo nihil. Voluptas atque nobis cumque aut qui quia. Iste esse ad quia iure et. Assumenda eius incidunt qui excepturi accusamus eius id.|5
1000001132|981|Quam maiores molestias sit ut consectetur id aut. Repellat in aliquam suscipit sequi laudantium. Sit exercitationem et repellendus autem est et ullam.|5
1000001136|915|Ea nulla nulla non dignissimos dolorem beatae. Esse aut illum alias sint et quasi. Pariatur quia molestiae fugiat quisquam voluptatem tempora aut corporis.|4
1000001137|140|Ipsa quaerat omnis molestiae. Quibusdam ut omnis vero. Porro numquam eos aperiam qui labore maiores eaque. Nam laudantium voluptatum voluptas.|5
1000001137|217|Fuga necessitatibus eos ea ducimus dignissimos sit. Reprehenderit voluptatem sit qui velit maxime itaque. Autem ut et labore voluptatem. Facilis consectetur cum sint omnis dolorem nihil in alias.|2
1000001139|66|Qui voluptatum enim voluptatem ducimus sequi. Nam dolore atque iusto. Perspiciatis neque fugit rerum ipsam dolorum.|2
1000001140|549|Eum consectetur sequi molestiae repudiandae ullam consectetur natus. Odit minima ullam maxime necessitatibus aut. Ut cumque necessitatibus rerum iste. Rerum doloribus qui repudiandae.|3
1000001141|592|Provident quasi laboriosam quis tenetur velit dolore non. Ut dignissimos illum consectetur molestiae officia voluptatem deleniti.|3
1000001142|610|Dolorem minima sunt a harum tempora. Amet dolore accusantium reprehenderit qui. Consequatur qui corporis sint et. Ea unde assumenda repudiandae nemo nesciunt accusantium.|3
1000001143|546|A ea quo quod a autem iste. Id doloribus tenetur impedit in beatae. Eum sunt sit non hic eos qui.|5
1000001143|904|Ullam sint qui quia reprehenderit. Qui quaerat doloribus voluptatem harum porro quisquam inventore. Natus ab consequatur sint et et ex. Ipsum sint culpa incidunt architecto enim fugit quia.|1
1000001147|183|Non qui ad sapiente soluta dolore. Id ea rerum non quas est magnam ipsum.|1
1000001150|103|Recusandae voluptatem ut sed libero et ad molestias dolor. Atque quia asperiores et doloribus quidem. Iste exercitationem id consequatur vel. Esse debitis voluptatum quis iure porro.|2
1000001151|284|Necessitatibus provident aut at molestiae. Et dolor consequatur quisquam ea aut et. Facere voluptas sit perspiciatis nostrum.|1
1000001151|707|Ut et eum dolor qui non molestiae. Illum praesentium sit harum aliquid. Rerum voluptatem et dolore rem qui. Voluptatem officia dignissimos numquam.|4
1000001152|575|Eos earum aliquam fugiat quos et aut nostrum beatae. Accusantium id beatae quis consequatur consequatur. Ut laboriosam nostrum nobis et.|5
1000001153|98|Voluptatibus id adipisci nulla voluptatum. Accusantium sequi quasi iusto quos voluptatem aperiam at asperiores. Architecto error alias labore eum.|4
1000001158|401|Aperiam consequatur rerum aut provident perspiciatis pariatur deleniti. Quisquam eveniet unde saepe rerum officiis expedita. Ullam aliquid incidunt ab eum aut.|3
1000001159|560|Eius ut ut modi dicta odio nemo laudantium. Ducimus aperiam et eveniet quo doloribus ex. Blanditiis autem voluptatem blanditiis ut. Modi quidem alias voluptates minima maxime aliquam cupiditate ut.|2
1000001159|85|Asperiores aut pariatur beatae ea deleniti magnam. Odio voluptate pariatur nisi sint placeat minima molestias. Tempora temporibus minus illo rerum non dicta. Iste vero hic laborum voluptatem in quia.|1
1000001161|287|At error magni earum et. Est nisi rerum aut doloribus. Est voluptatem quidem id rerum ad. Tempore esse accusantium minima nihil.|2
1000001163|923|Perferendis ad et necessitatibus placeat necessitatibus cumque amet. Officiis aut perspiciatis dolores voluptas suscipit. Alias sit ea occaecati autem.|4
1000001165|307|Placeat provident molestiae quaerat exercitationem eligendi. Iure quia sequi fugiat rerum laborum. Non error ea non ad est animi quo.|4
1000001165|82|Tempora earum et esse culpa nam quos enim. Ducimus laboriosam rerum vel cum aliquam. Perspiciatis repellat quas qui excepturi in facere molestiae. Veniam non quis tempora maiores beatae.|4
1000001169|2|Sint facilis nemo et culpa accusantium. Quo in consequuntur ipsum repellendus at ad omnis. Dolor aut consequatur praesentium sint ipsa quisquam aut eos.|1
1000001169|391|Ad vel provident porro molestiae. Consectetur impedit et accusantium dolores quam aperiam aut fugiat. Consequatur doloremque rerum est omnis sint. Quis nobis quae commodi sed similique.|2
1000001169|58|Provident error id sed tempora sed. Quos enim mollitia cupiditate. Et voluptatem rerum officiis est ipsa. Corporis alias in ut.|1
1000001173|914|Vitae velit accusantium consequatur voluptate deserunt voluptas. Id rem quo temporibus suscipit.|2
1000001176|219|Rerum architecto amet nihil eos. Similique quia est et molestiae. Iusto id et quis inventore qui aspernatur esse.|1
1000001176|466|Repellendus maxime sunt molestias sit. Esse nam assumenda dignissimos quaerat. Sed fugit est maxime qui accusantium harum a. Veritatis autem quasi ut velit.|3
1000001178|801|Provident quo voluptas odio enim sed a voluptatibus. Velit eos molestias officia tempore qui et. At rem laborum quae labore nobis temporibus.|3
1000001179|891|Eaque sit quia nesciunt fugiat quidem. Et porro et iusto quas ea. Facilis iste qui libero a placeat. Quia autem corporis earum magnam ut.|4
1000001180|916|Nulla facilis cupiditate qui et dolores. Dolore id et omnis cumque impedit aut blanditiis. Rem et impedit inventore aut maiores suscipit repudiandae numquam. Ut aut odio error recusandae nobis.|5
1000001181|955|Fugit soluta aut ut illum ut quae rerum. Suscipit eum ut sed quisquam quo eum mollitia. Reprehenderit occaecati nihil ut qui nesciunt.|4
1000001182|103|Unde asperiores aliquam consequatur maxime sapiente quas sit. Facilis rem rerum aliquid quia. In error voluptas voluptatem et doloribus consectetur.|5
1000001183|749|Eius architecto minus et illo. Quia dolores sequi voluptatem. Facilis minima iure doloremque nihil dolorum voluptatem velit.|5
1000001184|10|Velit reiciendis iste non id sint magni earum. Amet odit nihil eligendi alias ut. Minima nostrum explicabo maxime est.|2
1000001185|128|Ea suscipit atque quam minus illo. Quidem incidunt minus quasi omnis odio est. Ea cumque debitis officia modi. Magni ut a laudantium qui porro.|4
1000001185|426|Inventore tempore dolor voluptatem consequatur. Maiores modi libero repudiandae voluptatem labore. Iure molestiae est tenetur modi non. Fuga ipsa vel sed voluptatem.|4
1000001186|262|Sequi atque ut explicabo magni et quas in. Doloribus omnis dignissimos et. Et necessitatibus doloribus sunt illum voluptatibus labore explicabo.|1
1000001189|9|Fugit quia officiis molestiae labore earum eaque. Voluptas ratione sequi accusantium accusamus impedit numquam in est. Aut voluptate magnam et itaque.|4
1000001190|78|Tempore numquam fugit dolore ullam laudantium. Dignissimos quis qui nostrum possimus numquam et. Autem non quod accusamus maxime atque aut ab.|1
1000001191|732|Quae voluptatibus numquam deserunt quae numquam voluptas. Illum aut et consequatur deleniti laboriosam repellat qui. Ullam eligendi consequatur autem est tempore sint doloribus.|4
1000001192|77|Temporibus nulla est dolorem aut. Totam laudantium est sequi excepturi recusandae et enim. Similique quis dolor impedit nam inventore magni nobis. Molestiae vel aut sint nulla dolor mollitia.|5
1000001192|831|Sit corrupti accusantium eum voluptates corporis ad ullam autem. Autem et nisi ipsa quis at. Modi quisquam tempore molestiae voluptatum quo nam.|3
1000001194|546|Provident omnis neque accusantium consequatur ducimus. Voluptatem voluptatem et ullam ut nihil magni. Iste ut odit labore aut deserunt dolorum. Est est eum esse aliquam nostrum atque mollitia ea.|5
1000001195|939|Neque quia non consequatur nihil. Aut sint perferendis quia dolorum quia.|3
1000001196|524|Alias consequatur amet culpa neque itaque. Rerum aut in quas non quisquam aspernatur modi. Deserunt doloremque tenetur voluptate delectus sit voluptatibus quod sit.|4
1000001196|631|Veniam porro quibusdam voluptatem non sapiente nam. Et nobis qui nobis aperiam cupiditate.|4
1000001199|872|Sed animi nostrum consequatur sit. Voluptatibus mollitia laudantium unde eligendi iste est ut.|2
1000001201|256|Doloribus eligendi consequatur voluptatem voluptas enim sequi. Velit cupiditate minima modi. Minus eveniet quo voluptatibus qui consequatur.|1
1000001203|839|Quis nam officia optio excepturi occaecati facere. Et voluptatem voluptatibus et eaque at. Eum consequatur odit architecto praesentium.|4
1000001204|969|Voluptates odit eum est quas. Ipsa qui quia accusamus qui tempore eaque. Quibusdam sint facere nisi non sint. Voluptatibus maiores nisi quae.|5
1000001205|697|Mollitia voluptatem voluptas similique ad. Architecto rerum non totam voluptatem quod consequatur consequatur.|1
1000001206|686|Quidem animi magni consequuntur nesciunt adipisci numquam sint. Ut aut asperiores magni hic nesciunt. Laboriosam commodi voluptatibus animi adipisci dolores error nesciunt.|5
1000001208|231|Iure similique sint quis dolorem ipsum quibusdam. Vel autem aut vero et aut sequi cumque. Praesentium hic nesciunt et qui et qui ipsum optio.|3
1000001209|83|Aut et sit temporibus in. Perspiciatis aspernatur consectetur et et. Et quis qui fugiat assumenda laudantium vel. Asperiores ex sit architecto soluta.|1
1000001210|391|Aliquam maxime neque accusantium amet voluptatem. Sunt qui dolorem porro et ut nihil doloremque. Animi tenetur rerum vel non dicta qui sit voluptas. Aut dolorem natus et.|4
1000001210|70|Sed occaecati vero eligendi ad. Veniam dolorem eum cumque. Nulla cumque unde in sit et architecto perferendis id. Consequuntur nisi architecto nesciunt perferendis sed.|1
1000001210|818|Sint modi rerum quas. Excepturi adipisci laboriosam ad. Voluptatem labore unde facilis inventore est aperiam. A quos libero qui dolore perspiciatis delectus.|3
1000001210|971|Voluptatem repudiandae est labore sit magni. Minus laborum assumenda assumenda temporibus est ut fugit. Dicta deleniti ipsum sequi quidem. Consectetur eos consequatur et error dignissimos ullam.|3
1000001214|325|Earum voluptas sed dolorum officiis architecto ipsum quia. Harum asperiores dignissimos odit at repudiandae dolore accusamus. Accusamus natus reprehenderit et atque est.|2
1000001214|428|Enim vel sed nulla assumenda temporibus. Corporis aliquid mollitia autem vel doloribus et mollitia quibusdam. Ducimus aliquid earum natus saepe occaecati quo at.|2
1000001215|640|Rerum doloremque et iusto. Est totam dolorum consequatur autem cupiditate velit. Quia illum vitae sequi incidunt quam non. Consequatur molestias pariatur numquam.|1
1000001220|109|Qui voluptas natus velit at saepe facilis quis. Sapiente aut eligendi quos est tenetur amet. Rerum nihil quas omnis corrupti est debitis aut. Rerum unde at deleniti ut cupiditate et sunt ut.|1
1000001222|321|Harum numquam voluptatem aut corrupti fuga. Quaerat sit provident aut saepe repudiandae. Sed facilis iste natus aperiam reiciendis. Eius delectus praesentium sint.|2
1000001222|835|Sed fugit sequi at aspernatur. Non et illum id sit porro eveniet repudiandae. Qui cumque voluptatibus illo aut ut ullam aliquam non. Vel perferendis vitae id ex.|5
1000001223|414|Quod voluptatem aspernatur nesciunt recusandae autem. Tempore quam molestias et tempora. In dolor consequuntur earum possimus et neque. Blanditiis mollitia inventore deleniti consequatur.|4
1000001225|359|Ut delectus eum est quia nemo labore. Consequuntur sapiente ut consectetur dolorem. Eum enim et vel et libero. Eos consequatur qui et culpa.|2
1000001228|444|Et autem quia eos accusantium. Et nulla delectus magnam consequatur qui recusandae voluptas. Delectus facilis quod ad animi. Atque dolorum ut enim animi.|4
1000001228|805|Aliquid consequatur maiores facilis quasi. Officiis iste nobis quod aut praesentium rerum. Ea neque numquam facilis quo.|1
1000001229|64|Earum ea harum qui et consequatur impedit quo. Veniam qui non molestiae. Et nulla non fugiat dolores.|3
1000001229|744|Veniam et delectus perspiciatis dignissimos. Dignissimos odio blanditiis aut. Nemo officiis dolores cum voluptate.
1000001230|999|Eveniet adipisci dignissimos ut nam delectus dolore facere. Non ut sint necessitatibus unde. Quidem praesentium asperiores ut.|5
1000001234|328|Iusto est doloribus nihil doloremque est molestias voluptas. Ad illo animi est enim suscipit eligendi. Architecto architecto cumque exercitationem non ipsum aut sequi aut. Ut nulla in nisi sequi.|5
1000001238|218|Qui repellendus distinctio voluptas consectetur ut quo. Consequatur voluptate dicta et. Voluptatem non voluptatum consequuntur voluptatem voluptatem.|2
1000001239|138|Dicta qui molestiae dignissimos soluta. Quae cumque non suscipit qui consequatur. Dolores eius et autem quod qui ut ut.|5
1000001239|335|Nam et amet earum. Fugit aut eum sequi voluptatum. Veritatis ipsam consequuntur vel ut laborum minus non.|4
1000001239|781|Reprehenderit ab facilis nisi vel iusto. Aut soluta ut facilis nemo. Facere eos voluptas rerum amet ut saepe.|4
1000001240|918|Odit magni ratione itaque occaecati. Ut saepe laudantium et aut. Molestias veniam quis et. Beatae et amet id ipsum.|1
1000001246|385|Quo et asperiores molestiae repellat. Sit non quisquam non aut minima. Vel qui optio eius aliquam inventore. Cupiditate dolorem et repellendus similique eum odit.|1
1000001246|818|Aperiam quia quae non accusamus dolores. Aut enim perferendis accusantium sint ut iure fuga. Praesentium facilis et voluptas ipsam dolorem. Temporibus qui quis omnis ut nam eveniet hic id.|5
1000001248|824|Esse ut et quis aut et inventore praesentium. Voluptates fugiat est id exercitationem adipisci beatae. Nostrum et qui quo non qui dolores voluptatem mollitia. At et porro numquam.|1
1000001250|509|Iste libero natus ad consequatur voluptate. Quia quia dolorum iure et perspiciatis dolor. Architecto consequatur veritatis illo quasi ex. Cupiditate voluptatem quasi qui dolores.|3
1000001250|54|Ratione sunt ut saepe quae rerum. Dolore nihil voluptas libero quo dolorem quia placeat dolorem. Inventore voluptatum sunt corporis molestiae mollitia qui non.|2
1000001250|620|Iste non earum assumenda nobis reiciendis et consectetur. Dicta quam est explicabo sed. Eaque qui rem omnis unde et. Veniam in aut maxime quidem voluptas dolorem iste.|4
1000001253|504|Ex amet accusamus doloremque quasi reprehenderit ex nesciunt. Excepturi minus a libero perferendis consectetur quidem. Delectus debitis velit et commodi.|2
1000001254|909|Tempore hic quam perspiciatis sed molestiae. Et culpa ut expedita possimus. Odit quis sed numquam et maiores animi enim. Et amet mollitia a vel dolor ab a qui.|4
1000001254|920|Rerum sequi est beatae rerum rerum itaque dolor ipsam. Corporis eum pariatur enim. Sit incidunt rerum labore quo enim enim.|3
1000001256|106|Voluptas qui odit aut dolorum. Quam minus quaerat dicta rerum est. Nihil est sunt illum. Voluptatibus repudiandae qui et quas reprehenderit.|4
1000001259|49|Temporibus ratione quod sed ullam sunt. Sunt ut ut veniam cupiditate qui quia. Dolores tenetur quasi aperiam nihil. Voluptas ab molestiae iusto optio ab accusamus eos.|3
1000001259|637|Eos cumque dignissimos sed porro voluptas in omnis minima. Eos magnam commodi iste minus. Maxime eligendi eum soluta laborum.|1
1000001262|296|Molestiae voluptatum hic quibusdam excepturi. Dolor cum sed exercitationem quo sint error dolorum porro. Est tempora voluptate ratione.|3
1000001274|106|Voluptas voluptas explicabo numquam tempora sed dolorem. Qui iste dicta atque maiores qui ut. Voluptatem nemo reiciendis nesciunt ut.|3
1000001275|178|Facere sunt fugit iste quod est. Ut voluptas eos cum a incidunt. Consequatur voluptatem nobis qui voluptatem sapiente vel aliquam. Enim facilis eveniet cumque corporis eveniet voluptatem est earum.|5
1000001275|419|Dolores consequuntur et dolores aspernatur et. Vel excepturi officiis perspiciatis corporis itaque sunt. Est error nostrum qui enim architecto rem qui. Eum quia sed et aut et.|2
1000001277|119|Facilis ea optio modi aperiam. Quibusdam quis et ut quia magni aut excepturi. Aut ipsa laudantium ipsam facilis accusantium deserunt autem.|5
1000001277|999|Non dolores unde ratione voluptas ullam ut assumenda. Reprehenderit voluptatum tempora tempore et eum asperiores. Beatae aut dolore et consequatur. Modi et corrupti et ut sequi omnis similique.|3
1000001278|250|Sunt ut asperiores qui enim. Earum eaque qui voluptatem est. Impedit quibusdam illum cumque necessitatibus distinctio dolorem provident.|1
1000001278|359|Qui velit doloribus consequatur consequatur ut occaecati eligendi ducimus. Harum nihil quo dolores. Architecto hic quasi labore omnis molestiae.|1
1000001279|50|Sed vitae qui dicta accusantium. Enim aut officia qui ratione qui ea. Accusamus voluptatem autem dolores.|1
1000001280|777|Distinctio veritatis sit labore corporis. Sed dolorem cumque adipisci dolorem quia placeat. Omnis officiis eos consequatur odit.|2
1000001282|194|Consectetur quos unde eius numquam odio. Pariatur error eligendi id quos.|2
1000001282|403|Officiis praesentium molestias quia et tenetur. Cum nisi saepe nesciunt aut temporibus.|3
1000001283|815|Officia nam impedit voluptatem earum fuga fugiat commodi. Fugiat consectetur optio optio adipisci distinctio et. Voluptatem et omnis ipsum iste cumque dolorum.|5
1000001286|878|Facere et quaerat quia delectus sunt corrupti. Blanditiis animi voluptas et. Et aperiam aliquam dolorem ad.|4
1000001287|447|Quisquam tenetur et est explicabo a doloremque et eius. Ut earum qui dolorum assumenda. Exercitationem omnis voluptatem maiores quia.|5
1000001287|501|Quas expedita culpa cumque est magni aut saepe eum. Vero iste repellat totam qui enim fugiat tempore. Expedita autem sunt illum dignissimos id similique nihil.|4
1000001289|302|Quia quam aut id ex harum omnis. Beatae deleniti doloribus deleniti corrupti natus aperiam error. Aut necessitatibus dolor sit.|2
1000001289|410|Vero deleniti dignissimos nulla. Optio esse voluptas quasi. Tempore non ut doloribus.|1
1000001290|446|Magnam voluptatem quas et. Sunt aperiam omnis eaque. Qui hic adipisci veritatis nam. Eligendi est et ipsum voluptates voluptas eveniet.|3
1000001292|836|Molestiae natus et nesciunt modi qui. Ratione non asperiores blanditiis veritatis vel iste. Asperiores sint consequuntur quae placeat facere cupiditate totam in.|2
1000001293|793|Ratione omnis modi harum et nostrum. Sapiente et voluptate in. Quisquam adipisci consequuntur aut qui. Rerum cupiditate provident perspiciatis quia ad eveniet consequatur.|1
1000001297|474|Explicabo quis aut voluptatum voluptatibus. Aliquam iste hic inventore voluptatum nisi similique itaque. Eos eum eum numquam sint illo perferendis.|4
1000001299|543|Iure perferendis aliquid deserunt enim temporibus. Provident illum nisi sunt eum doloribus impedit. Velit consequatur quibusdam non et natus et.|2
1000001300|279|Et quo nulla odit qui optio voluptatem. Quo non quidem alias officia qui. Expedita in quidem animi eaque facere officiis.|2
1000001301|999|Perspiciatis nisi quia voluptatem. Necessitatibus qui expedita aspernatur eveniet numquam vero.|3
1000001305|817|Fugiat rem perferendis eaque doloribus et et dolores delectus. Omnis aperiam incidunt itaque eum. Sint unde iste provident.|5
1000001306|634|Dicta alias voluptatem eius tempora mollitia. Dolores aspernatur perspiciatis praesentium occaecati dolores. Debitis laboriosam aliquid facilis voluptatum quam omnis.|4
1000001308|427|Fugit molestiae consequuntur harum asperiores ducimus numquam tenetur dicta. Aut voluptatibus mollitia sequi. Optio nulla enim tenetur voluptatum. Enim quidem iure odio debitis quia quia.|1
1000001309|168|Numquam est quod voluptatem. Dolor voluptates itaque natus accusamus voluptatem odio alias. Asperiores et vel accusantium deserunt voluptatem.|5
1000001309|94|Quae dicta similique non vitae voluptas reiciendis. Consequatur voluptatem numquam nihil voluptas omnis aut soluta. Odit vitae ut dolor aut. Ab dignissimos doloremque eos at.|4
1000001310|383|Sit est nihil culpa aliquid aut. Non dolores quam consequatur sit qui maiores at sequi. Rerum quo ad quos corrupti cumque consequatur non. Et ea enim consectetur et vitae occaecati dolorem.|1
1000001312|895|Aperiam voluptas quo tempore explicabo molestiae vel qui. Et in aut sunt quis minima.|5
1000001313|215|Et itaque ut est consectetur ipsum voluptas enim aperiam. Sed sint ducimus explicabo sint. Atque nihil error accusantium nam magnam nesciunt qui. Ut aut et sint.|1
1000001313|409|Id optio earum vitae id deleniti repellendus. Asperiores voluptatem distinctio sit ab quia qui fugiat rem. Sapiente et in dicta explicabo corrupti quibusdam.|5
1000001317|665|Rerum repellendus et consequatur distinctio sunt. Porro aliquam laboriosam accusamus dignissimos.|3
1000001319|273|Laudantium aliquam omnis porro ullam. Ex eligendi hic asperiores. Natus consequatur quia doloremque dicta officiis iste ea.|2
1000001319|805|Et alias quia ratione modi quos ex. Sed fugit dolor nihil soluta et et. Modi impedit possimus omnis quis beatae perspiciatis sit. Sequi totam blanditiis qui cupiditate recusandae.|2
1000001320|137|At a ut natus magni officiis asperiores et. Quibusdam voluptas ducimus qui hic. Dolorum architecto nisi in voluptatem ea.|1
1000001320|840|Velit blanditiis cumque ipsum omnis unde neque labore. Quaerat nam dolorem quasi voluptas dicta. Earum ut vel nisi ea eveniet. Sit non et quam perspiciatis et dolorem dolor.|4
1000001322|185|Repudiandae hic nihil aspernatur iste saepe et. Quibusdam laudantium nemo vel voluptas fugit sit nulla. Aut ratione fugit rerum consectetur occaecati. Cumque saepe id voluptatem id quis qui.|1
1000001322|232|Id vitae et iusto aliquam laudantium. Expedita quidem alias quia mollitia at. Dolorum hic impedit in earum ut.|2
1000001322|346|Unde aut blanditiis nobis facilis ratione. Quia molestiae repudiandae sapiente est. Quia provident mollitia accusantium dolorem excepturi quam. Praesentium rerum minus exercitationem aliquam.|4
1000001322|872|Rerum ad voluptatem quia eum sunt aspernatur. Aspernatur temporibus non qui quam. Dolorem commodi voluptate ut nihil inventore. Similique totam corrupti in iusto iste sint.|4
1000001325|446|Perspiciatis ipsum aut voluptatem totam. Eveniet ratione veritatis ex ut. Vel voluptas hic harum molestiae id.|1
1000001325|641|Dignissimos ut nulla quis voluptas aliquid. Illo facilis sunt ducimus occaecati aut soluta. Ab voluptas expedita nemo aut quis. Vero eius placeat porro sunt occaecati ut.|4
1000001326|465|Autem tempora quis eum ea repudiandae quo fuga. Quia exercitationem aut vero voluptatem qui blanditiis quia. Placeat expedita alias blanditiis quo placeat. Suscipit cupiditate aut velit consequatur.|5
1000001327|150|Facere reprehenderit occaecati quibusdam non. Asperiores voluptates nihil voluptatibus commodi. Molestias nisi omnis ut culpa aut accusantium.|4
1000001328|733|Doloribus vel sapiente suscipit corporis earum. Sit ut repudiandae vel deserunt quam. Quos aut voluptatem ducimus optio quaerat. Eum dolorem ratione aut animi tempore delectus.|1
1000001331|697|Quidem aut earum tempore in et iusto sapiente. Iusto esse minus est commodi. Veniam neque quae rerum velit cum voluptatum eveniet voluptatem.|1
1000001335|62|Qui ad est provident et ab. Laudantium nesciunt eos reprehenderit odio non iure voluptas. Magnam voluptate assumenda molestiae aperiam.|1
1000001337|993|Pariatur iure est cupiditate itaque repudiandae. Reiciendis ad dolor odit et. Odio et nihil vel quasi tenetur.|5
1000001341|223|Modi quas nemo dolorum debitis. Non consequuntur quia unde atque sequi. Quisquam itaque exercitationem harum aliquam quisquam libero repudiandae. Illo illo dolores pariatur.|5
