1000000307|296|Veritatis nobis ducimus consequuntur perspiciatis accusantium. Quia rem aut sint atque. Deserunt rerum occaecati in iure. Aliquid temporibus voluptatibus et in. Atque voluptatem cum quasi quasi non.|3
1000000309|612|Excepturi ea sequi illum officiis inventore. Et rem unde voluptatem ea. Maiores dolor voluptate facere optio quos porro laudantium.|1
1000000309|699|Sit optio officiis aut culpa ullam. Sit reprehenderit ipsa delectus. Est molestias et quos quis facere.|3
1000000310|299|Corrupti et qui dolores. Sit distinctio esse eligendi quia vel. Quia aperiam recusandae velit accusamus placeat sint. Error nobis et consequatur facere nisi.|2
1000000310|950|Dolorem sequi libero odio animi repellendus sit. Aut sequi et id qui rerum. Molestiae aut id magni ut voluptas veritatis et.|4
1000000312|915|Non rem repellat rem minus et eveniet. Soluta repudiandae ratione numquam animi laboriosam necessitatibus velit. Iure non saepe culpa perspiciatis est incidunt at.|1
1000000313|911|Aut ipsum rerum a perspiciatis. Minima omnis et molestias exercitationem animi. Provident distinctio rem quas consequatur aut iste quaerat. Sed assumenda alias eos ducimus.|5
1000000314|803|Aut dolor delectus facere quas culpa. Quos veritatis nesciunt aut quia quod. Nihil fugit vero nostrum occaecati doloribus odio numquam.|1
1000000315|421|Fugiat porro debitis voluptatem et non quo porro sint. Itaque excepturi voluptates eos. Perspiciatis et error deserunt autem. Optio qui sequi itaque optio voluptatem id.|5
1000000317|981|Ducimus aut ea recusandae dolores qui eos et. Et dolorem consequatur aperiam atque in. Voluptatum vel magnam architecto impedit ad quisquam. Beatae accusamus dicta modi numquam aut placeat.|2
1000000322|649|Quo sit architecto non sed aut. Totam soluta dolor voluptates dolor qui suscipit. Reiciendis modi id eligendi in quibusdam aut.|5
1000000323|363|Ipsa possimus blanditiis dolor provident omnis velit. Neque in quis vitae voluptatem voluptas. Et voluptatem qui neque est. Placeat eaque repellat ea beatae earum quia ratione.|5
1000000323|940|Ab ipsum ut non et omnis. Enim fugiat itaque suscipit illo alias dolores odio. Esse dolorem sed sed provident perspiciatis cum quia. Illum deserunt dolor dolor.|1
1000000325|102|Exercitationem provident explicabo quia eos quia. Et dolor quis non ipsum sit qui temporibus aliquam. Id laborum et placeat at soluta.|2
1000000326|385|Commodi ex nisi est soluta aut optio ut at. Ut ratione doloremque culpa. Dolore non hic et distinctio dolores aut.|5
1000000326|901|Consequatur dolorem et praesentium quaerat. Et voluptatem eum voluptas porro. Quae veniam et fugiat laudantium sequi officia aliquid sapiente.|4
1000000331|449|In quis autem sed id est culpa. Aut qui ab nobis ut dolores autem cupiditate. Culpa tempora aut reprehenderit libero iure aut et tempore.|1
1000000334|681|Fugiat reprehenderit commodi exercitationem eius. Unde et voluptatibus earum culpa suscipit. Tempora eius aliquid velit provident vel. Et maiores adipisci aut fugit ut. Id debitis similique ut ipsum.|4
1000000335|310|Hic et et beatae nisi debitis soluta laudantium. Ut ullam aut maxime. A maxime eligendi voluptas rerum sunt. Sed quo itaque aut omnis nobis fugiat.|1
1000000343|556|Distinctio at qui ut maxime pariatur. Quas dolor deleniti est hic fuga. Ullam veniam mollitia sed sed voluptas veniam similique. Ipsum sunt a omnis voluptates.|5
1000000344|265|Numquam reprehenderit aut delectus. Rem praesentium natus laborum molestiae sint. Labore nemo non quaerat tempora. Optio ullam aperiam molestias vitae in quod totam.|5
1000000344|969|Est sed eum quo porro officia totam. Facilis quia cupiditate aut placeat commodi. Iure atque eius accusantium dolorum expedita quaerat cupiditate. Omnis sed quia quis dolor.|5
1000000346|690|Quibusdam non ut aliquam dolore doloremque. Nisi doloribus quis accusamus tempore. Autem eligendi vel unde libero enim.|3
1000000348|514|Inventore pariatur quod voluptas libero. Neque dignissimos porro beatae soluta facilis. Ut eum explicabo et nam repudiandae rerum numquam. Quia molestias aut aut quidem provident provident numquam.|5
1000000348|985|Et omnis autem ea est tenetur dolor. In voluptatibus reprehenderit voluptatem natus aut repellat. Soluta vitae sed excepturi voluptate et. Reiciendis eum dolorem delectus sapiente laborum.|2
1000000349|818|Explicabo placeat tempore nemo. Laboriosam eum expedita commodi natus aut. Nam qui aut quia ut non dolores.|1
1000000350|863|Laborum est ipsa molestiae quos vero ipsa. Qui et rem sit. Pariatur dolor ipsam dignissimos eaque quidem quia tempora. Non quia laboriosam voluptatem earum libero qui.|2
1000000351|426|Recusandae qui quia recusandae maxime ratione quo soluta. Expedita molestiae quis et qui. Aut occaecati repudiandae aut aut pariatur nulla.|3
1000000354|324|At ut inventore quo reiciendis quia sapiente minus. Pariatur vero est et et. Iste veniam nihil nostrum distinctio quibusdam vel aliquid.|3
1000000356|768|Sed doloribus repellendus sit aut. Deserunt molestiae doloremque dolor vel. Corrupti tempora sit magnam rem esse.|2
1000000358|16|Illum et in inventore voluptatem incidunt. Sapiente libero non tenetur maiores explicabo aut harum. Amet dolor possimus aliquid necessitatibus temporibus itaque quos.|1
1000000358|873|Harum voluptate veritatis et illo et. Dolor commodi vel sit hic. Sit aut fuga rerum iure ut recusandae eveniet. Quam animi rem enim sed maxime et.|1
1000000359|539|Nisi in pariatur non consequatur dolorem expedita. Omnis earum dolorem minus sit eligendi illum illo. Omnis sit nesciunt officia nemo fugiat.|4
1000000360|256|Est illo ea ipsam. Veniam et et nemo blanditiis.|3
1000000363|680|Illo ut accusamus dolore ut eveniet. Magnam odio aut voluptatem laborum. Quidem eligendi et est labore incidunt vel assumenda. Ducimus et velit quos voluptas.|4
1000000365|869|Sequi consectetur itaque et libero magnam dolorem repellat. Vel nihil quasi et amet. Aperiam quidem reiciendis officia modi consequatur iure blanditiis.|3
1000000365|923|Dolorum beatae impedit quia est. Quo nihil quia eum animi aut. Placeat similique dolore nobis nam inventore illum ut.|1
1000000368|894|Qui qui ducimus dolorem et aspernatur et. Dignissimos quisquam cupiditate repellat et.|2
1000000368|98|Qui consequuntur doloremque excepturi ab eaque. Dolore animi rerum excepturi alias hic corporis. Rerum minus dolore tenetur ut est aut quibusdam.|3
1000000369|289|Optio laboriosam odio consectetur nihil accusantium. Nihil qui ipsam inventore similique in sit dolorem. Eos perspiciatis sequi consequuntur quibusdam. Aut cum corrupti repellendus et at inventore.|2
1000000369|796|Repudiandae accusantium quam eveniet et unde modi. Dolorem architecto et tenetur illum delectus id voluptas. Ipsam eum nostrum deleniti placeat. Autem earum autem et quis perspiciatis quae ut.|3
1000000372|467|Esse repellat beatae et. Consequuntur aperiam laboriosam ut et consequatur culpa. Voluptas inventore veniam quo. Cumque iure vel repellendus neque sed magni id.|3
1000000375|757|Delectus sit quis ipsam aspernatur fuga et et consectetur. Aliquam nemo minima dolor assumenda. Sint eos cumque non ipsa est quia reiciendis.|3
1000000376|940|Dolor temporibus esse consequatur eius velit sapiente. Et vero neque assumenda atque. Quam excepturi occaecati neque error. Adipisci libero ipsum sequi eos.|1
1000000378|480|Quasi iste inventore veniam autem ut minus recusandae. Exercitationem in velit vitae est nesciunt necessitatibus veniam.|1
1000000379|621|Omnis voluptatem molestiae velit odio. Dicta velit et hic numquam. Sed sequi ex recusandae veritatis. Et distinctio nulla velit.|3
1000000382|255|Et a enim aspernatur aut soluta quasi ut eaque. Ipsum modi accusantium qui perspiciatis perspiciatis. Et doloribus est eos nihil. Et et qui ut a facilis.|1
1000000385|157|Autem nesciunt nesciunt qui perferendis nihil quam quas. Odit voluptas vero at id consequuntur. Aut sed aut asperiores rem nostrum et fuga ad.|3
1000000386|487|Nihil aperiam aut ea repellat est magni. Eveniet odio ipsam eaque et quod. Distinctio illum incidunt iure autem. Dolore laudantium in repellendus totam ipsa necessitatibus reprehenderit.|5
1000000389|188|Velit quisquam dolor aut tempore officia tempora voluptatem. Voluptate et distinctio id odio quia pariatur occaecati. In optio qui corrupti minima aut aut tempore.|3
1000000389|94|Delectus voluptate laudantium aperiam dolores. Suscipit distinctio autem molestiae quia libero id eveniet ut. Impedit quidem nesciunt est rerum deleniti qui.|2
1000000390|325|Commodi in error sunt itaque exercitationem et. Sapiente eum dolor commodi est facere ut. Fuga nostrum architecto nobis quos sed iure eligendi. Velit quisquam voluptates ea.|5
1000000392|645|Consectetur quia eaque unde est. Aliquam sed perferendis ea nobis dolores. Modi provident sunt aut magnam. Minima laboriosam consequatur alias. Repellat modi accusamus voluptatum ex et.|2
1000000393|291|Commodi nesciunt autem molestiae voluptas rerum aut. Quasi sed est distinctio necessitatibus in. Quo id facilis dolore et fuga. Culpa vitae ratione aliquam recusandae.|1
1000000395|922|Commodi eligendi quia labore consequuntur doloremque vero qui. Harum voluptatem exercitationem ut ducimus voluptatem. Ab reiciendis voluptas facilis esse voluptatem possimus.|4
1000000396|942|Sunt in quis quae. Ipsam labore cumque dolores qui sed exercitationem exercitationem. Labore deserunt maiores vel quisquam aspernatur in voluptas eveniet.|5
1000000398|142|In minima recusandae qui odio autem voluptatem. Culpa nulla et ullam est doloribus perspiciatis. Minima est itaque voluptatibus fugit sit nisi architecto quisquam.|1
1000000401|495|Aut dolor quod consequatur repellendus. Necessitatibus et quos aut quibusdam omnis sapiente. Eum et aut neque fuga et molestiae.|2
1000000401|58|Molestiae incidunt quasi tenetur molestiae. Natus quis ab veniam temporibus repudiandae. Blanditiis vitae sit nihil velit occaecati explicabo.|1
1000000401|755|Animi animi qui qui qui consequatur non. Magnam aut sint quia. Dicta accusamus sit possimus molestias.|2
1000000403|387|Saepe corporis asperiores non optio incidunt. Soluta porro delectus tempore accusantium ea itaque. Voluptate et quod repudiandae excepturi possimus.|4
1000000403|942|Non commodi libero odio rerum ut harum. Quasi est quos quas vel sed qui voluptatem. Ea repellat nulla repudiandae delectus.|1
1000000408|196|Cupiditate rerum quisquam sunt recusandae. Et temporibus velit et harum quod porro ducimus sed. Consectetur non repellat tempora vel quis. Placeat tempore qui qui animi id nemo amet eaque.|2
1000000408|694|Deserunt aut dignissimos sunt. Et est aliquam magnam quam est dicta. Et sed est placeat reiciendis ea.|3
1000000408|75|Est eveniet quos eum ratione. Unde odio et et sit velit. Reprehenderit et placeat repellendus molestiae.
1000000409|833|Omnis aut vel fugiat fugit nihil nostrum labore. Explicabo qui nisi omnis non placeat. Perspiciatis repellendus veritatis qui doloremque esse. Sed repellendus ut recusandae cum.|4
1000000410|499|Nihil veritatis sapiente voluptatem modi molestias occaecati. Quia ducimus ut culpa dignissimos. Accusamus nihil in itaque cupiditate et nemo assumenda et.|2
1000000413|133|Sint neque consequuntur quod id omnis. Qui accusamus nisi ea voluptatem debitis eius sapiente. Sint nihil quis quisquam labore ea voluptates quia.|4
1000000415|764|Aliquid vero voluptatem accusamus officia ullam. Minus numquam est aut ab officia. Eos quasi doloremque quisquam aut atque debitis recusandae cupiditate.|4
1000000415|995|Corrupti dolor enim et tempore quasi aut rerum hic. Consequatur error praesentium sint omnis. Qui quia dolorum recusandae natus id.|1
1000000417|749|Autem nesciunt qui aspernatur esse qui sint. Et corporis architecto sapiente ducimus est. Excepturi velit officiis voluptas in quis vel facilis deleniti. Et alias ea aut id quibusdam ipsum.|5
1000000417|934|Maxime eum animi omnis quaerat quia et illum occaecati. Nulla magnam dolor quam. Voluptatem voluptates reprehenderit sed at et qui debitis quis.|2
1000000420|558|Ipsum sapiente nesciunt libero doloribus. Voluptas et tempora qui aut. Ipsam earum dolor perferendis in nulla reiciendis non.|5
1000000421|253|Sit illo quisquam voluptas sit et et autem. Accusantium distinctio est est non. Sit est sunt harum harum consequatur accusamus ducimus. Molestiae soluta accusantium nesciunt aliquam.|5
1000000424|878|Qui aut iusto aut. Qui veritatis provident voluptas consequuntur. Et ratione veniam cum quas qui ea.|1
1000000427|15|Est aut nemo consequatur sit impedit deserunt magnam saepe. Suscipit consectetur modi numquam aliquid porro est. Ut autem voluptate atque blanditiis magnam dolor id est.|2
1000000429|663|Debitis inventore quo rerum quo eos provident. Non cum omnis ex expedita saepe. Dignissimos provident maiores ea. Iste autem sint ipsum minima.|3
1000000431|464|Aut aut dolor odit quaerat et et. Accusamus modi voluptatem officiis nobis et accusamus. Et dolores sit laborum voluptatibus est quis ullam. Ratione error dolorum cum.|4
1000000432|345|Vitae minus eius et quaerat. Doloribus corrupti unde iure omnis. Voluptates dolorum voluptatem quae officiis asperiores veritatis consequatur. Corrupti ad molestias non officiis modi cum.|2
1000000432|936|Eligendi blanditiis enim eligendi in amet enim. Repudiandae suscipit qui libero veniam corrupti. Sed incidunt animi iste voluptatibus odio.|2
1000000434|614|Iusto occaecati id eligendi eos. Atque voluptas est dolores quidem magnam ipsam iusto et.|4
1000000434|725|Sint aut beatae laborum est iure aut eligendi. Quaerat quia reprehenderit voluptate ipsum repellat similique impedit.|4
1000000437|83|Voluptas eius accusamus est est ratione officia. Et voluptatem voluptates vitae nihil quo expedita. Repellat quis autem laborum. In blanditiis occaecati vel distinctio enim.|4
1000000438|871|Vero sapiente id est placeat maxime ut molestiae. A suscipit laudantium et omnis est unde rerum et.|2
1000000439|105|Pariatur rerum expedita ullam molestiae nisi. Beatae et non fuga sapiente consequuntur ad. Incidunt quo voluptas cumque eum blanditiis ab neque. Aut veniam aperiam rerum ut est dicta.|5
1000000442|794|Dolore illo deserunt corrupti dolorem ad. Iusto perferendis et cum et dolor dicta. In aperiam quia consequuntur facilis corrupti saepe molestias. Labore dolor et numquam error.|3
1000000446|608|Praesentium et quisquam tenetur vel odit. Et deserunt tempora tempore aut asperiores. Ad aut temporibus quia illo.|2
1000000447|615|Voluptatem quidem quis ut totam quia consequatur. Molestiae vitae ullam et ut. Dolor ducimus fuga voluptatibus earum illo quisquam. Quidem ab possimus modi ducimus quaerat quidem quaerat.|5
1000000449|762|Quam temporibus delectus repellat nihil ut eius illo. Accusantium sed voluptatem odio et. Libero deserunt laborum eos illo iure sit magnam.|2
1000000450|34|Ea quia aut quos. Et molestias sunt eaque omnis ut omnis aut consequatur. Omnis ipsa ut aut velit est tempora.|1
1000000450|853|Ut illum corporis dolores cum saepe. Unde est et ut magnam praesentium ut. Voluptas voluptatem sit omnis id omnis officia architecto ut. Ad corporis aut tenetur ipsa voluptatibus eaque.|4
1000000450|867|Molestias et perferendis inventore. Libero ut ipsam molestias corporis. Perferendis tempora optio amet dolorem amet repudiandae. Quis aut et dolore cupiditate qui consequatur atque non.|5
1000000453|213|Iusto possimus ut optio vel totam et. Quia illo magni officia officiis sapiente occaecati. Delectus id culpa est.|1
1000000455|900|In quam et fuga maxime perspiciatis porro porro. Voluptatem possimus nemo quasi distinctio rem perferendis est asperiores. Iste voluptatem beatae sit omnis soluta. Doloribus dolores sit sed.|4
1000000456|993|Architecto laudantium sed aut a nostrum tempora. Nam voluptate adipisci eius eius et. Odit voluptatibus quod quisquam eius nihil sit sunt est. Qui alias eius sed voluptas modi deleniti qui.|3
1000000458|710|Illo ut consequuntur voluptatem eveniet. Rerum fugit debitis quos sunt fuga aliquam. Iusto quo blanditiis officia voluptates est maiores eaque.|4
1000000460|487|Ut ullam ut accusantium qui pariatur consequatur optio. Aperiam minus labore a eaque laboriosam quia. Autem asperiores delectus eum omnis molestias et ea.|5
1000000460|827|Earum et et reiciendis enim expedita dolores voluptas. Adipisci delectus doloremque perspiciatis. Porro non aut et.|1
1000000461|110|Quia sint nemo voluptatem aut laudantium iure velit. Ut soluta perferendis hic occaecati vitae.|5
1000000463|972|Voluptatum architecto ut quisquam quisquam provident dignissimos. Aut sed quasi et ut et. Reprehenderit aperiam omnis ut et. Aut similique consectetur ipsum sint ut molestiae rerum.|4
1000000464|306|Iure voluptas nemo esse sint harum temporibus. Officia excepturi dolore et. Corrupti veritatis facere distinctio deserunt molestias eos. Odit voluptatem sit et minima dolor.|4
1000000466|179|Illo nemo aut repellendus repellendus vero. Sed dicta voluptas sed voluptatem. Ex quos voluptates vel dignissimos voluptas. Est dolores consequatur qui libero esse qui soluta expedita.|5
1000000468|153|Eligendi cum suscipit et eum qui. Et quam error soluta hic quaerat quibusdam voluptate. Similique quasi aut molestiae dolores facere cum. Assumenda sit reiciendis nesciunt voluptatem ut.|3
1000000468|489|Eius fugit quasi alias est. Magnam dolores consequatur rerum aut dicta. Illum ducimus ab quam. Et aut possimus et doloremque molestiae inventore sapiente.|5
1000000468|605|Qui aliquam magni tempore quia. Vel quia eos assumenda earum necessitatibus debitis consequatur. Quia et blanditiis consequatur. Ea maxime doloremque soluta et eius.|2
1000000470|495|At dolorum nulla in doloremque quia. Voluptas doloremque sint sint eum sunt rerum et. Quibusdam unde molestias velit.|3
1000000473|504|Fuga laboriosam velit atque sed soluta sit. Aspernatur saepe ea pariatur aut reprehenderit eligendi. Dolorem aut itaque cum voluptatum consectetur.|5
1000000473|708|Saepe alias ad quia sapiente. Aliquid qui facilis pariatur id. Doloribus magnam et modi quis voluptatem.|4
1000000478|776|Quam est beatae aut totam voluptas dolores omnis libero. Qui nobis et magni qui dicta non. Voluptatem et veniam rerum error. Rerum similique ex quia eos laborum debitis.|4
1000000480|905|Nihil amet et suscipit. Voluptas impedit voluptates autem quod fugit modi perspiciatis. Blanditiis omnis tenetur cum assumenda. Recusandae quisquam aperiam sapiente dolorum eos pariatur ut.|2
1000000481|298|Nostrum ea beatae ut non consequatur qui dolor. Quidem nihil molestiae quidem. Officiis et voluptas nostrum occaecati sed. Commodi optio velit magni harum.|1
1000000490|142|Cupiditate perspiciatis totam eius tempore laboriosam. Id voluptas sint est ipsum labore est. Tempore quo iure enim saepe officia. Earum voluptatem quo commodi officiis nostrum debitis.|1
1000000490|631|Consequatur et quo sed placeat. Reprehenderit velit incidunt corrupti distinctio. Iste dolorem animi possimus dolore dolor. Vel et est inventore iure.|4
1000000491|565|Numquam nihil mollitia sit aspernatur iusto. Blanditiis dolores ipsum qui fugiat.|4
1000000491|645|Enim reiciendis accusamus vitae est pariatur dicta autem. Minima et quis ipsa incidunt aut est. Repellendus facilis repudiandae omnis. Maiores aut qui enim.|1
1000000493|812|Beatae nisi et qui nesciunt repudiandae. Ad assumenda blanditiis cumque qui voluptas. Sit vel et quia dolor sit consequatur. Eos enim ab voluptatibus et labore et quae.|5
1000000494|34|Dolore sed qui voluptatum quia quia. Porro officiis pariatur consequatur neque veniam.
1000000495|776|Consequatur pariatur impedit veniam corrupti quaerat eius quibusdam. A qui error minima doloremque impedit qui quia fugiat.|3
1000000498|483|Nisi assumenda dolor illo beatae autem nobis exercitationem. Facere magnam velit iste ea. Nobis maiores repellat atque eveniet optio illum temporibus. Rerum perferendis dolor veniam quod facilis.|5
1000000502|453|Voluptas rerum dicta officiis id rerum aspernatur. Velit aliquid quae nostrum et impedit et ut. Illo quia dolorem accusantium eaque eum molestiae sed. Autem tempore ad harum in voluptate.|5
1000000503|985|Eum explicabo est nesciunt consequatur quo recusandae. Optio doloremque nam atque beatae numquam quasi sed dolorum. Consequatur vel tenetur est et illum ut libero magni.|3
1000000506|706|Quod atque neque sit omnis ut voluptate officia quis. Dignissimos asperiores omnis at et assumenda totam quam. Et beatae voluptatem impedit itaque minima cum inventore vitae.|3
1000000507|875|In quis rerum quisquam et non. Rerum repudiandae animi est ipsa. Architecto est rem consectetur exercitationem. Pariatur optio ut voluptas ad.|4
1000000509|836|Rem eius vel quia velit culpa. Eos hic possimus at. Blanditiis totam aliquam sint a.|1
1000000510|229|Quasi rerum pariatur molestias quas. Ea esse est sed enim tempore vero pariatur impedit.|3
1000000511|492|Dicta cumque magnam nemo dolorum distinctio est reprehenderit quaerat. Nisi nemo ad commodi ut natus sit quia. Deleniti neque dicta ea velit aspernatur voluptatum incidunt.|5
1000000511|521|Magnam dolorum et aliquam eos aperiam voluptas temporibus accusantium. Perferendis libero in ab sit est. Cum deserunt distinctio soluta.|4
1000000512|533|Praesentium ab eaque libero. Consequatur rerum dolor mollitia voluptatem rem in. Qui dignissimos beatae autem nam.|5
1000000512|801|Architecto fugiat quo sed molestiae neque. Illo et dicta ab repellendus rerum vero aut provident. Earum officiis officia impedit minus provident asperiores. Eos eos ut nisi velit nihil illo.|5
1000000515|507|Voluptas sed rerum similique et pariatur suscipit. Ad ut repellendus explicabo illo expedita error modi. Dolor totam vel quas.|3
1000000515|629|Officia fugit fugit iure nisi non corporis velit molestiae. Eligendi eum commodi et odit minima qui quo. Tempora aut error et aut delectus assumenda.|5
1000000516|122|Fugit repellendus ut temporibus rerum. Eos tenetur fugiat placeat rem voluptas. Deserunt omnis quia delectus ipsum minima.|3
1000000517|397|Quos doloribus distinctio amet non id et. Impedit mollitia animi assumenda magni ea exercitationem nesciunt. Qui in ad sit fugit sed. Doloribus sunt explicabo quibusdam perferendis cum et fuga.|5
1000000520|587|Eum aut quia aliquid natus aut sit. Odio quia officia consequatur voluptas consequatur.|2
1000000526|295|Facere qui odio eligendi provident voluptatem commodi. Quia tempore dolores laborum et ex aliquam vitae. Sit placeat officia architecto aspernatur.|5
1000000527|694|Architecto magnam minima minus. Soluta expedita perspiciatis vitae minus corrupti maxime. Voluptas quis repellat rem eligendi exercitationem eos et et.|3
1000000529|864|Ut rem totam omnis alias doloremque suscipit nihil. Delectus impedit ut provident. Magni molestias repellendus eos voluptatem facilis.|5
1000000530|361|Accusantium sunt laudantium commodi ut porro. Dolorem doloribus optio ut. Nesciunt dolorem sed beatae et qui aut recusandae. Saepe sit quis sint sit cumque corrupti.|5
1000000531|175|Non et architecto ut explicabo sint dolorum. Aut voluptatem perspiciatis dolorum natus beatae. Inventore qui impedit excepturi cupiditate aspernatur ab consectetur facere.|1
1000000531|648|Laboriosam vel ut cupiditate dolores. Nobis provident et sunt vitae minima amet rerum.|1
1000000532|557|Omnis expedita non id modi itaque ratione aut. Et exercitationem occaecati qui quos voluptas in ab. Ut magnam laborum id sint et facilis.|5
1000000533|235|Aut saepe nulla ut et enim eaque. Sit ut laudantium eum omnis est inventore. Voluptas maiores non velit voluptatem.|2
1000000534|420|Nulla delectus quis mollitia atque quidem odio quidem pariatur. Adipisci omnis assumenda sapiente. Sint dicta cupiditate itaque. Velit nihil labore et tenetur odio quod.|2
1000000534|581|Molestiae culpa et suscipit deserunt. Quas mollitia qui consequatur omnis quisquam amet et eligendi. Possimus voluptates et cupiditate molestiae.|4
1000000538|649|Quia debitis aut aut officiis esse quam. Ut amet necessitatibus numquam maiores tempora illum. Non fugit dolores molestiae id et. Pariatur repellat quas et odio adipisci.|5
1000000541|521|Iusto omnis cupiditate autem quidem quod ex natus. Architecto esse debitis reprehenderit temporibus culpa. Ea enim quia autem perferendis. Perferendis corrupti ipsam vel qui quod voluptas.|1
1000000545|89|Tempora eum facilis non placeat sed dolorem voluptatibus. Autem sed iure tenetur. Qui reiciendis eum eum et natus eveniet fugiat dolorum.|1
1000000551|676|Est amet eligendi et quia. Recusandae asperiores dolorem nesciunt laudantium sed sint. Quas neque temporibus odit molestiae quibusdam.|1
1000000555|669|Adipisci itaque in harum ea. Ut corporis omnis tempora. Quo at deleniti voluptatibus nobis quas et itaque iusto.|4
1000000556|758|Officia explicabo iste rerum ab. Rerum cupiditate incidunt porro optio.|1
1000000558|221|Placeat vero velit exercitationem sunt. Eos aliquam assumenda error aliquid necessitatibus nobis. Harum vitae asperiores id harum modi fugiat placeat. Repudiandae repellendus quod qui eius qui.|5
1000000559|4|Ut in possimus voluptas veniam. Quasi amet et illum ut molestiae quos deleniti. Tenetur debitis natus et enim non enim aut. Molestiae molestiae itaque aliquam optio.|5
1000000559|599|Et odio laboriosam animi quae velit est. Architecto voluptatem aut aspernatur dolorem. Sit fuga quod ut at eligendi possimus. Est est veniam cumque quisquam et. Quos at amet aut deserunt.|2
1000000560|532|Voluptas et aspernatur tenetur. Maxime qui accusamus voluptatum aut atque et et exercitationem. Vel eveniet autem voluptas hic molestiae voluptates.|1
1000000561|51|Ea ut perferendis voluptatibus tempore. Et itaque quae blanditiis nesciunt ullam quis. Saepe enim non natus ut odit quia quidem. Officia consectetur illo eveniet vitae velit.|4
