1000000035|183|Id voluptatum et vel eum ratione et vel beatae. Ea eum similique quam. Omnis velit ex facere.|5
1000000035|374|Vel reiciendis eius ea. Nihil quidem molestiae et ea aut. Omnis perferendis et voluptatem qui ea veritatis id occaecati.|2
1000000035|4|Nihil deserunt ipsum perspiciatis. Iusto voluptatem provident placeat ea. Nostrum odit eum ut itaque nemo qui omnis perferendis. Quos in est ratione at. Perferendis reprehenderit quia quis sed sed.|5
1000000035|461|Voluptatem facilis aut accusamus iusto facere laborum debitis qui. Cum sapiente et quam commodi voluptatem modi deserunt ea.|2
1000000037|116|Modi aut dolores mollitia qui aspernatur consequatur. Sequi consequatur sequi nulla tempora ipsum rerum a sit. Non esse qui nobis delectus provident atque architecto sint.|5
1000000038|648|Quisquam provident sint sit. Quod labore magni quasi eveniet. Debitis iure aut laudantium iure voluptatem eos.|5
1000000038|863|Quia eligendi eum nulla. Exercitationem omnis ducimus nemo voluptatibus possimus. Perferendis consequatur excepturi qui ut quae eveniet et.|4
1000000041|483|Aut eaque dolorum eos illum voluptates numquam nobis. In nisi in et quam provident ea ut modi. Sit suscipit ut accusamus placeat doloribus.|1
1000000043|363|Voluptates quasi totam at. Esse reiciendis itaque qui facilis. Labore animi aliquid unde dolorem. Sit dolor quasi placeat tempora quo quia tempore.|1
1000000043|609|Et sequi tenetur fugiat ut quos quia fuga. Voluptates libero molestias culpa distinctio est unde. Corrupti vero reprehenderit esse recusandae. Dolor veniam ut nostrum dolores blanditiis.|3
1000000046|874|Quos est ut et ut ea nesciunt optio. Repellendus consequatur et nulla vel. Molestias sed voluptatum asperiores deleniti iure voluptatem officia voluptatem.|3
1000000047|452|Consectetur est atque non illo sit excepturi eligendi. Rem harum id rem tenetur maiores labore exercitationem. Cupiditate et ut aut enim. Possimus quis ut aspernatur fugiat architecto libero sit.|1
1000000048|323|Sunt repellat reprehenderit sunt aperiam expedita dolores voluptates. Est voluptas quia ea ab quis iste unde. Saepe sequi quibusdam aut quas sit voluptas et. Explicabo accusamus ea ut sunt quis.|2
1000000048|456|Voluptatem dignissimos reprehenderit quia voluptates sunt. At repellat est consequatur. Ut ipsam aut voluptas velit.|4
1000000048|84|Accusantium est sit voluptatem ut ut sit cum. Non quis quas incidunt. Ullam minima est iusto totam ullam dolores porro doloribus. Accusantium excepturi odit non.|2
1000000051|423|Voluptatem placeat excepturi sint occaecati ratione ratione a. Animi iure ut repudiandae qui. Fuga dolores voluptatum ipsum accusantium. Odio asperiores perspiciatis ut possimus quas dolorum libero.|2
1000000051|689|Laborum explicabo earum debitis dicta aut. A error voluptas nihil qui magnam voluptas. Quo fuga dolorem numquam animi omnis ut quidem. Provident quis eum non dicta aut.|5
1000000052|700|Aspernatur qui possimus iusto ullam delectus amet non. Maiores nulla blanditiis itaque earum. Cumque sequi nam dolore ut. Architecto velit voluptatibus consequatur.|3
1000000054|238|Ipsum quod et totam commodi recusandae. Optio autem nulla deleniti necessitatibus consequatur deleniti. Cupiditate asperiores incidunt in et nobis. Sed laudantium ut quia sint velit at est et.|5
1000000055|48|Optio alias ipsum similique iure libero sit aut. Ea iure illum molestiae officia qui et et hic. Atque sit voluptatem natus consequuntur at id dolorem.|2
1000000055|735|Molestias debitis corporis veniam omnis. Cum omnis sequi optio ipsam et. Veniam nemo excepturi sit est ut ex iusto. Corporis sed omnis labore qui sunt fuga laudantium.|1
1000000056|333|Et debitis eligendi ex ab nisi debitis. Voluptatem consectetur saepe aut doloribus. Quia sed placeat magni nisi et sit.
1000000057|260|Ducimus voluptatem maiores ipsa magni sequi officia assumenda. Id doloribus facere accusamus inventore eligendi quis. Quasi vel laborum fuga. Rerum quam iusto sequi labore quam explicabo.|4
1000000060|112|Consequatur voluptates eaque aspernatur voluptates non at. Eos eos nihil repudiandae maiores assumenda commodi. Dolore et sed sunt consequuntur.|4
1000000060|963|Dignissimos in accusantium quasi maiores. Omnis fugiat odit sit sed molestiae nulla suscipit. Sint mollitia est ut officia saepe iste.|4
1000000061|333|Rerum et repellat sed aut nihil. Quisquam voluptatem aspernatur qui in. Qui rerum et et.
1000000063|116|Qui sunt rerum hic eum corporis explicabo. Et voluptatem delectus hic nam dignissimos dolores. Non laboriosam pariatur quia quis voluptates.|2
1000000063|348|Molestiae est et aut voluptatem odit eum molestiae eos. Et enim placeat provident iste provident nihil iure. Harum eius in voluptatem ipsam. Eveniet commodi quisquam deserunt.|1
1000000064|479|Iste atque enim consectetur vero. Quo sunt et quia magnam quos tenetur ipsam. Sed delectus fugiat atque labore veritatis beatae.|2
1000000068|235|Debitis illo unde voluptas et vel quibusdam pariatur nihil. Aliquid animi ex modi dolor accusantium voluptate. Qui ut nam aut quia quo aut nam deserunt. Nobis iusto nisi non debitis et fuga.|4
1000000068|928|Est quia quae commodi ipsum minima aut libero. Quia voluptate dolores nostrum dicta ipsam consequuntur at. Id ut voluptatum nihil repudiandae.|2
1000000074|197|Est id aut est inventore. Eum vitae consectetur eos est soluta. Laborum nihil corporis labore et quaerat.|2
1000000074|826|Voluptas laborum est ullam ducimus debitis. Impedit quia eius accusantium ut officiis iusto repellat voluptatem. Rerum placeat provident eveniet voluptas. Aut ea sunt illo quod.|1
1000000075|881|Ducimus enim culpa provident consequatur ut nostrum. In pariatur aliquam quia enim voluptate quo non.|5
1000000077|573|Quia qui saepe quos eos quo nihil. Illum vitae culpa itaque. Ea minus sequi ut. Error ut dolores expedita maiores similique fugiat laborum.|2
1000000078|686|Suscipit harum et eos quia. Maiores culpa ratione libero nesciunt incidunt maxime adipisci. Non enim ullam quae voluptatem eos.|3
1000000081|841|Est et omnis recusandae eos rem quibusdam fugit. Natus aut maxime dolorem modi consequuntur. Qui eum fugit sint dicta.|1
1000000083|508|Culpa accusamus ut quam iure. Sit aut nobis fuga. Earum temporibus omnis minus aut.|1
1000000084|510|Eaque laudantium placeat odit modi numquam ut blanditiis. Eos quia blanditiis nemo quia animi. Sint ducimus mollitia sequi reiciendis.|4
1000000085|385|Modi et quod modi vel qui repellendus at aut. Dolores eius quia debitis deserunt.|4
1000000086|303|Aut accusantium possimus velit eum expedita a reiciendis. Nulla dolore blanditiis vero debitis nisi rerum. Est fuga a incidunt ut aut.|4
1000000087|898|Cumque quaerat nihil ut autem. Voluptatibus libero adipisci nisi incidunt nemo. Alias alias repellendus iure corporis.|1
1000000089|122|Et tempore repudiandae eligendi maxime veritatis quia. Id ut harum omnis aspernatur soluta eos dolor. Tenetur porro in accusantium tenetur autem. Aperiam saepe ut quo quia maxime quam ut iure.|2
1000000089|844|Animi in quis qui necessitatibus quia libero excepturi. Accusantium atque sint consequatur. Sequi sed accusantium qui est voluptate.|3
1000000091|214|Dolorem ut quidem deserunt. Rem deleniti eos ea laudantium. Eum numquam perspiciatis sed aut beatae est doloremque.|4
1000000092|174|Incidunt porro sit error aliquam perspiciatis dolorum aut aut. Sunt mollitia amet dolores fugiat eveniet.|4
1000000092|751|Qui impedit beatae incidunt quis sed sapiente. Est at est ad. Et et voluptates est eaque autem.|3
1000000095|488|Possimus eaque vero dolor perspiciatis. In nemo aut eum. Consectetur architecto blanditiis voluptatem et ipsum non.|3
1000000096|17|Dolorem minima consequatur quibusdam occaecati eius. Dicta quidem atque earum praesentium vel molestias. Non ut aut dolor et aut. Aut provident ut quae porro earum cumque consectetur.|2
1000000096|519|Et pariatur at beatae sed voluptate unde omnis. Animi dignissimos qui quidem ut est impedit. In ut ea voluptas enim temporibus minima. Minima illo aut doloribus qui enim laboriosam.|3
1000000100|172|Iure velit sint quibusdam. Tenetur omnis illum temporibus.|3
1000000102|363|Praesentium est ut sed mollitia vel omnis sed. Enim quia id voluptatem. Vel molestiae optio quam ut necessitatibus reiciendis. Labore asperiores sequi aut.|4
1000000106|318|Voluptate nisi qui iure error. Soluta ab officia id rerum quos rerum.|1
1000000107|308|Aut voluptates quasi illo voluptas. Dolorum optio quis reiciendis nulla ullam. Nisi dignissimos qui eius accusamus dignissimos hic. Praesentium illo consequatur dolorum necessitatibus.|3
1000000107|909|Aut ullam id distinctio non. Cum vitae est sunt rerum qui repellat maxime. Quisquam ipsa deserunt aut numquam illum rem. Qui odit nam nulla ea. Doloremque nam repellendus aut sed.|4
1000000109|628|Vero qui placeat non facere. Officiis quasi laudantium aliquam expedita vel quia facilis. Veniam asperiores ut qui consequatur.|3
1000000110|372|Cum praesentium saepe soluta aliquid perferendis dicta nihil. Quisquam qui et cupiditate odio. Ut non voluptatem id vitae at temporibus. Autem et aliquam quisquam iusto.|1
1000000113|208|Corporis pariatur et id molestias blanditiis. Eius alias dolore ad impedit ullam explicabo. Alias ad qui laudantium sed illo praesentium.|1
1000000117|183|Rerum veritatis illum sed aut. Ducimus ullam quibusdam voluptatem et iure est nostrum. Adipisci totam ut rem ea cumque.|4
1000000117|403|Libero quo dolores quia atque facere voluptate aut. Autem id quia velit quidem. Quibusdam voluptatibus est dolorum id. Beatae laudantium voluptatibus provident est atque modi fuga animi.|1
1000000118|770|Eos eos aut molestiae non delectus error tempore. Est sapiente commodi commodi quia quia ullam.
1000000118|807|Velit non distinctio et vitae hic eum. Alias eveniet dolorem ratione qui aut consequatur pariatur. Enim dolor ipsa ut placeat et. Itaque in nostrum facere dolorum ex.|4
1000000118|9|Natus qui deleniti ab ipsum. Quod suscipit qui accusantium qui nemo tempora. Iste architecto consequuntur maiores praesentium.|2
1000000119|252|Molestiae facere impedit alias corrupti. Ut corporis fuga eos est aut iusto qui voluptas. Molestiae magnam sint necessitatibus quibusdam odit. Rem molestiae exercitationem sed.|4
1000000121|446|Dolores assumenda voluptatem omnis sed saepe. Doloribus dolores et deleniti. Molestiae libero voluptates sit qui. Non blanditiis molestiae ipsam ducimus doloribus.|2
1000000127|976|Expedita veniam et saepe omnis quis. Ex rerum ut adipisci exercitationem. Facere est aut quidem iure. Est vel voluptatibus possimus minus eos.|2
1000000133|128|Tempora at quos repudiandae vitae magnam sunt nihil voluptates. Est assumenda sed consequatur qui et vitae eveniet. Deserunt commodi officiis eius sequi ratione atque in.|5
1000000135|578|Qui itaque et animi dolores porro iusto quo. Vel totam et architecto et. Ratione itaque est ipsum sit amet.|4
1000000137|135|Eos qui praesentium ipsa quo et. Temporibus eos aut est quaerat unde. Eaque odio laudantium suscipit. Libero asperiores modi rerum qui.|4
1000000137|63|Dolor qui temporibus dolores pariatur vel accusamus. Tempora et quis officiis dignissimos est nesciunt explicabo at.|1
1000000138|493|Ipsam ea in non ex autem ducimus. Et autem unde necessitatibus dolor est velit est soluta. Eum rerum veritatis dolorem beatae odit odit.|4
1000000139|891|Velit quo aut id facilis et aut. Sit dolores est consequatur eligendi. Enim expedita aut laudantium omnis velit sit quo.|3
1000000142|947|Et corrupti perspiciatis ratione odit. Labore distinctio earum nisi amet occaecati autem saepe. Impedit eum quaerat occaecati quis reiciendis adipisci qui esse.|3
1000000144|113|Molestiae quo dicta voluptatum laborum aperiam quasi autem ut. Exercitationem modi sunt maxime officia. Officia quasi ad iusto sit vero beatae quis.|5
1000000145|714|Qui harum repellat dolorem vero minima sequi nulla earum. Ut tenetur ullam ut accusamus sunt. Aut omnis cupiditate est perferendis et quis aut quae.|2
1000000147|149|Et voluptatem nobis voluptatem ut. Porro laborum voluptas quod. Fugiat velit delectus fugiat aut blanditiis sunt.|3
1000000148|351|Sit minus quos aut. Culpa non doloribus deleniti est sed. Accusamus dolorem numquam praesentium ut officia aspernatur sint.|2
1000000148|794|Qui excepturi adipisci nemo esse similique nihil. Illum nam nam ut amet nam repudiandae voluptate. Unde eius ea quibusdam optio sit consequatur ipsum.|5
1000000149|415|Nobis eius nesciunt qui similique. Et perferendis aut voluptas ea perferendis vitae rerum.|3
1000000151|996|Et excepturi quasi quod alias sapiente voluptatum. Et impedit dolor tenetur esse nemo ut. Et omnis dolor et quis.|2
1000000153|577|Aut earum quibusdam consequatur id. Id sed sed commodi quod. Quibusdam debitis dolores maiores perferendis perspiciatis non dolores.|3
1000000155|131|Velit tempore in rem est reiciendis. Reprehenderit nam nihil consequuntur eum est.|5
1000000163|268|Voluptatem aperiam odio ut maxime. Architecto eaque quia dolorem molestias. Sit ullam voluptates error quam optio nostrum natus. Quia amet est dolorum.|1
1000000166|598|Dolores quos est provident. Numquam magnam praesentium voluptatem blanditiis id aliquid sit et. Dolore ut exercitationem hic voluptates sunt qui iure qui.|3
1000000167|908|Delectus nihil sequi nihil sequi porro. Porro perspiciatis assumenda quae et. Reprehenderit assumenda ut quia temporibus velit deleniti nostrum.|3
1000000172|771|Sit et quos vitae. Magnam sint commodi harum et est. Qui veniam ipsum velit et dolores quod tempore.|3
1000000181|380|Error deleniti sit aut facere nisi molestiae et. Sunt consequatur nihil rerum voluptatem iusto dolor. Voluptatem consequuntur mollitia molestias eaque saepe debitis amet. Vero enim est et modi.|2
1000000184|953|Rem sapiente molestiae sunt ut incidunt quia et. Ad quam consequatur nisi veniam nihil ipsum.|3
1000000188|248|Et est corrupti nihil illo quod nihil. Ea unde nulla alias pariatur quidem at. Voluptate et perspiciatis quia animi id distinctio mollitia necessitatibus.|3
1000000188|889|Occaecati ab tempore alias esse dolores laudantium. Id in enim consequatur provident. Aut voluptatem saepe nihil culpa.|2
1000000190|976|Amet sit sit dolor exercitationem. Consequatur sunt ad enim laborum voluptas in vitae. Libero quia enim voluptas neque sed autem a officia. Culpa recusandae accusamus ipsa optio.|4
1000000191|688|Fugit fugit corporis omnis a. Atque eligendi nobis accusantium similique sit dolores sed sint. Fugiat veniam voluptatem est tempora sed ullam.|1
1000000192|645|Mollitia quia cum suscipit aut eos in. Non repellat voluptas rerum qui ullam. Dolorem magnam magnam ad eius ut illum et. Culpa quasi ratione aliquid ducimus.|1
1000000195|848|Aut asperiores saepe est quod reprehenderit assumenda dolore. Voluptates officiis ut ducimus cupiditate eaque.|5
1000000195|980|Saepe dolores totam ex ut. Autem maiores quisquam deleniti velit minima totam. Voluptatem non magnam rem vel et aut. Quas harum molestiae soluta.|3
1000000196|749|Amet voluptatem nulla doloremque. Ab accusantium praesentium consequatur aut dignissimos eos repudiandae ipsum. Error amet omnis et error voluptatem eligendi sed. Rerum qui nihil accusantium quis.|1
1000000197|854|Dolorem quia est aliquid. Similique ipsa ab autem minima omnis. Amet quia minus qui alias.|1
1000000198|667|Veniam ea quisquam blanditiis cumque. Laudantium perferendis nulla iste aliquid. Odio maiores mollitia atque fugiat velit dicta eos.|4
1000000203|309|Veritatis eum velit velit incidunt itaque. Minus praesentium minus et itaque voluptate laboriosam. Et voluptatem veniam maxime impedit exercitationem.|5
1000000205|810|Qui quo magnam fugiat non. Excepturi corrupti consectetur quod nam ut. Non quos delectus sit est reiciendis. Fugit culpa laborum sed dignissimos.|3
1000000205|822|Similique et non voluptate mollitia esse. Ipsum soluta perspiciatis minima perspiciatis dolores modi sit sunt. Optio aut praesentium qui veniam minima. Consequuntur non ut aut ut quia totam.|4
1000000206|45|Eum non et dolorum occaecati voluptas totam. Quos totam ducimus cumque omnis dignissimos fugit molestiae aut. Pariatur impedit nostrum tempore optio.|1
1000000208|214|Ut omnis repellat tempora nemo a. Qui qui cupiditate ad sed reprehenderit doloribus fugiat. Sed ipsam esse et libero sunt explicabo.|2
1000000208|38|Officia magnam explicabo et repellendus recusandae dolor. Vel repudiandae sed est eum. Sit odit doloribus incidunt voluptatem quam amet nisi.|3
1000000211|299|Voluptatibus eum quasi iure. Iste est ipsum alias laborum velit assumenda enim quam. Similique et vitae doloribus ullam dolores et.|3
1000000213|502|Error sint a mollitia sint vel. Dolorem enim illum fuga quia est et rerum. Beatae ut voluptatem sed in rerum facere quae. Est soluta eos fuga id.|2
1000000214|396|Quod et qui quae quam harum. Labore est beatae et sunt. Eaque quia est minima nemo repudiandae fugiat provident. Deserunt et enim praesentium.|1
1000000215|756|Nihil alias ea sint repellat quam. Ut ratione nulla eum libero itaque. Suscipit nihil quis laboriosam itaque voluptas minus beatae similique.|5
1000000217|828|Qui ullam rerum maiores ducimus aliquid. Quidem excepturi amet magnam et numquam. Facilis ab porro totam eveniet ut. Autem voluptatem quidem nihil accusamus suscipit.|5
1000000220|471|Quam eveniet cum aspernatur eum amet explicabo. Ut est suscipit et. Perferendis ad officia sit tenetur vel.
1000000221|300|Consequuntur quasi ex quia doloremque maxime. Aut dolor debitis totam voluptatum dolore dolores. Veniam autem maiores asperiores delectus blanditiis eius distinctio.|5
1000000225|188|Repellat aut repudiandae ut. Itaque qui iste voluptas velit autem occaecati dolores. Dolores quia vitae earum tenetur.|1
1000000226|617|Eius sit dolores deserunt aliquid atque optio consectetur. Eligendi tempora adipisci iste aliquam ipsa et rerum. Sunt quisquam nemo quam quaerat ipsam perspiciatis velit.|1
1000000228|508|Iure dolore possimus a a necessitatibus et. Minima sapiente dolor sint accusantium veritatis quidem. Aut ut sit sit eos.|2
1000000235|613|Dolore modi ut perspiciatis commodi nostrum. Ut sequi et rerum doloremque nobis rem.|3
1000000237|363|Quo assumenda qui expedita enim est ut. Sed veritatis vitae consequuntur porro voluptatibus rem. Voluptas sapiente esse eos error et ut voluptate.|3
1000000237|374|Recusandae vero alias consectetur molestias. Nemo assumenda autem hic autem. Dolores laborum similique velit beatae temporibus quisquam veritatis.|5
1000000240|633|Nihil ut expedita repudiandae praesentium iste. Consequuntur et tenetur fugiat pariatur. Maiores facere quasi quas alias rerum aut ratione. Suscipit inventore eligendi earum et.|4
1000000240|848|Natus nam esse possimus natus consequuntur. Assumenda sunt reiciendis modi dicta quae id. A exercitationem dolore aliquam dolorem eveniet repellat. Libero in perferendis ipsam et excepturi non quis.|5
1000000241|259|Nihil et qui iste. Ipsam asperiores aliquam qui. A quod repellendus ad quasi soluta maiores.|2
1000000243|137|Voluptatem qui voluptatem error voluptas. Harum consequatur sed et harum totam necessitatibus. Non id molestias dicta illum accusamus qui.|2
1000000244|32|Molestiae et qui dolor sed ab impedit qui. Vel voluptas error qui non necessitatibus aliquid.|4
1000000249|134|Est et ad vel sed iusto est soluta quia. Magnam dignissimos nostrum hic quo qui maiores. Et esse assumenda corporis qui qui. Quos eos expedita enim illum. Dolor est voluptatibus deleniti qui.|3
1000000250|260|Itaque esse vel odio rerum. Magni quidem corrupti quod. Et sed praesentium aut quas totam quia.|1
1000000250|367|Veniam illo eaque deserunt et omnis nisi. Eveniet amet ut minus earum. Et reiciendis consequatur aut iure non. Porro harum aut ea et. Impedit expedita unde explicabo soluta.|3
1000000251|582|Aut eius eaque voluptas non hic nobis explicabo. Adipisci hic sit itaque facilis esse sit esse.|1
1000000253|274|Doloribus similique architecto in soluta. Id quo est nesciunt consectetur ullam ratione. Sed beatae vel est quam perferendis ut error.|2
1000000253|417|Aut rerum ipsum nihil rerum magnam. Voluptatum ipsum exercitationem et qui iusto deleniti odio. Fugit dolore esse enim. Omnis autem ipsa deserunt dolores ex alias.|1
1000000254|802|Inventore quaerat reprehenderit amet quo. Dignissimos voluptate rem aliquid aliquid est itaque labore. Et labore et qui vel nesciunt.|3
1000000255|951|Ut aperiam veritatis consectetur vel id. Aliquid et a aliquam possimus sed ratione. Eum iusto ut quis qui reprehenderit.|4
1000000257|950|Quis et iusto modi ut ea est. Quod veritatis praesentium qui unde veniam rerum in. Nostrum quod sint est ut doloribus.|4
1000000259|506|Et natus odio culpa aut. Nisi dignissimos quia vel earum ipsum rerum. Dolor earum illo voluptate aut pariatur aut eveniet ea.|2
1000000266|227|Praesentium nemo incidunt repudiandae optio et repellat. Cupiditate perspiciatis laudantium rerum molestiae qui eius animi. Rerum cum nisi officia dicta iusto.|2
1000000266|821|Qui aliquid aspernatur sit eum mollitia similique corporis. Est amet voluptatem adipisci ab. Impedit impedit laborum quo aut ut sequi magni. Et recusandae velit quis inventore minus et aut.|2
1000000268|411|Magni quas maxime vitae officia. Tempore fugit consequuntur quisquam consequatur tempore modi sit. Inventore aut magnam ratione debitis sed maiores modi consectetur.|1
1000000268|866|Autem ipsam quas iusto quia. Minima qui beatae praesentium consequatur unde sunt. Reprehenderit quisquam at rerum. Non assumenda non aperiam ratione minus quo eaque.|4
1000000271|598|Vel veritatis atque sunt sint odio expedita. Beatae molestiae id cumque ut sunt saepe et consequatur.|2
1000000272|309|Eum voluptates aut ad eligendi nesciunt corporis voluptas consequatur. Nihil error et cum velit dolore sed. Totam nemo veritatis optio occaecati.|4
1000000273|24|Consequuntur eos nostrum harum quos quia ullam. Minus a molestias labore odit. Dolor et at autem qui maxime nobis voluptas. Et sunt sint quibusdam veniam.|2
1000000273|26|Dolorem aut voluptatibus exercitationem asperiores ipsum ipsam autem aut. Aut et iste molestiae ad.|3
1000000274|386|Est sunt aut iusto ipsa quos mollitia. Quibusdam deleniti quidem nobis aliquid. Dolorum voluptate voluptatem ullam est ipsam perspiciatis.|2
1000000279|125|Natus suscipit beatae culpa voluptatum ut sint neque. Quo et non omnis qui corporis eos. Aperiam quia quia perferendis natus minima suscipit accusamus.|2
1000000279|695|Quos quaerat quam consequatur et. Distinctio doloremque qui rerum suscipit quasi beatae corporis. Earum quia laborum laudantium repellendus. Recusandae molestiae eius molestiae consequatur.|4
1000000282|318|In maxime accusantium quo et autem perferendis consequatur. Aperiam iste aut dolore non. Velit ut consequatur quod corrupti accusantium ea repellendus voluptates.|4
1000000283|553|Sint dolor enim ab. Pariatur et est voluptas officia tempore. Velit fuga delectus qui eius quisquam quidem quod et.|4
1000000284|686|Eos eos rerum mollitia saepe ut sed distinctio et. In hic enim recusandae. Deleniti placeat autem illum enim veniam sit dolores. Dolorem sunt ea placeat distinctio eos corporis consectetur.|5
1000000284|748|Maxime error sapiente voluptatem ipsum. Fugiat et aliquam velit eos odit. Recusandae dolorem nihil ea corporis veniam. Neque est expedita facilis inventore consectetur alias ea quibusdam.|5
1000000285|251|Pariatur aut debitis veniam assumenda. Voluptas ullam molestias numquam nostrum voluptas commodi inventore.|2
1000000287|423|Aut voluptas id veniam qui tenetur. Est dolore perspiciatis qui. Ipsam error reprehenderit omnis animi quia. Doloremque dignissimos ex facere.|5
1000000287|598|Hic delectus ex sed sapiente ex qui. Vitae nemo est corporis totam. Illo aliquam sequi ut neque autem. Eos nihil ut iusto.|4
1000000287|663|Et vel voluptas nam odit ut et. Laudantium commodi facilis voluptatem exercitationem. Facilis ut consectetur qui beatae.|1
1000000289|800|Et optio cumque dolores reiciendis odit. Debitis error porro excepturi sequi reprehenderit. Sapiente et et nulla corrupti. Officiis velit qui omnis modi.|1
1000000290|179|Aut unde maiores rerum omnis deserunt necessitatibus ut sed. Iusto voluptas ratione in vel laboriosam consequuntur blanditiis. Recusandae modi distinctio id.|2
1000000294|702|Deleniti alias non omnis repellat ducimus. Sit illo facilis ut et quam iusto esse et.
1000000296|969|Vel optio dolore impedit sit quia quis animi. Corrupti a eos ut voluptas natus alias perferendis. Consequuntur ipsa quas quia quisquam qui et.|2
1000000297|438|Qui sint dignissimos quae saepe ut eos dignissimos. Molestiae autem non est tempore enim. Reiciendis in quis est enim.|4
1000000298|474|Enim est aut eius sed. Sed tenetur fugiat corporis nesciunt. Qui voluptatibus odit voluptate quia quaerat.|4
1000000298|714|Omnis doloribus accusamus distinctio sint eligendi officia officiis nisi. Velit autem minus dolorem commodi voluptatem atque ut.|4
1000000299|5|Iure qui praesentium eos aliquid sit. Asperiores nesciunt qui et aut dolore. Qui temporibus blanditiis omnis enim non dolores vero. Beatae inventore aut et fugit ad repellat.|2
1000000301|281|Et nostrum porro fuga sed quis architecto expedita. Cum qui omnis voluptate eaque voluptas aperiam. Non facilis nesciunt ut iure atque.|2
1000000303|834|Sunt id quis adipisci molestiae. Et exercitationem ut fugit labore quia. Est mollitia quo laboriosam magnam harum quaerat. Culpa non voluptas consequatur eum laboriosam doloribus explicabo.|3
1000000304|650|Adipisci ullam id aut dicta est. Ad voluptas officia tenetur recusandae ab. Nostrum quis et ea sunt facilis. Qui qui ea enim quod.|5
